Query,Doc_ID
Sugar water may be better than apple juice.,MED-1792 MED-2491 MED-5019 MED-4590 MED-3945 MED-2969 MED-3908 MED-4090 MED-4029 MED-4267
Veal is a type of meat derived from calves.,MED-4801 MED-4437 MED-4747 MED-3499 MED-1770 MED-1768 MED-5339 MED-729 MED-1759 MED-2671
Doctors responded to being named a leading killer in a certain way.,MED-2525 MED-2082 MED-2744 MED-1350 MED-3636 MED-3755 MED-3577 MED-4806 MED-5303 MED-1655
Cholesterol may be related to lower back pain.,MED-4424 MED-4031 MED-2524 MED-2488 MED-5330 MED-3398 MED-1885 MED-4509 MED-1258 MED-1207
Heart disease prevention faces obstacles.,MED-2525 MED-1194 MED-4613 MED-4255 MED-1679 MED-1999 MED-5331 MED-4559 MED-1680 MED-1399
Citrus has the potential to assist in maintaining warm hands.,MED-3204 MED-4392 MED-2713 MED-3483 MED-2707 MED-3942 MED-3476 MED-2271 MED-3203 MED-3744
Autophagy is exploited to extend lifespan.,MED-2510 MED-2325 MED-2502 MED-1378 MED-2498 MED-2517 MED-2324 MED-2509 MED-4222 MED-1724
salmon uses?,MED-3882 MED-4354 MED-4961 MED-3024 MED-3651 MED-2745 MED-4791 MED-4933 MED-4429 MED-2740
Vegetables are pitted against cancer.,MED-3726 MED-3620 MED-4861 MED-3245 MED-3238 MED-2580 MED-4024 MED-5111 MED-5010 MED-4620
What is Fosamax used for?,MED-3193 MED-3787 MED-2831 MED-2281 MED-1112 MED-3247 MED-1791 MED-2827 MED-2244 MED-1113
Can you provide information on Finland?,MED-10 MED-3981 MED-4727 MED-1276 MED-4070 MED-3980 MED-5331 MED-3480 MED-3976 MED-1201
What is neurocysticercosis?,MED-3178 MED-3177 MED-3179 MED-3175 MED-3172 MED-4672 MED-3181 MED-3169 MED-3170 MED-3180
Czechoslovakia was a country in Central Europe.,MED-2479 MED-5331 MED-2256 MED-3587 MED-2024 MED-4672 MED-3178 MED-2009 MED-2254 MED-2087
Food dyes have a potential relationship with ADHD.,MED-3382 MED-3380 MED-2616 MED-906 MED-2618 MED-3381 MED-4655 MED-4604 MED-1153 MED-2416
There have been incidents involving unexpected or undesirable events that cause harm or damage.,MED-2270 MED-2350 MED-2650 MED-3567 MED-1496 MED-1279 MED-4365 MED-4872 MED-3590 MED-2400
Fava beans.,MED-2570 MED-2147 MED-2010 MED-1880 MED-2144 MED-5080 MED-4991 MED-5079 MED-3138 MED-4510
The cause of Americas obesity problem is what?,MED-1994 MED-2717 MED-1468 MED-2723 MED-2715 MED-1798 MED-1328 MED-4202 MED-4100 MED-1803
What is molasses?,MED-5056 MED-4782 MED-4126 MED-3811 MED-4416 MED-4716 MED-3945 MED-4867 MED-1794 MED-4125
Is fog harmful to fish?,MED-2756 MED-5099 MED-3592 MED-1570 MED-4966 MED-4958 MED-3022 MED-3031 MED-4959 MED-4733
"Excessive iodine can have negative consequences, just like insufficient iodine.",MED-4662 MED-4668 MED-4665 MED-4666 MED-3444 MED-3445 MED-4664 MED-3971 MED-3448 MED-4660
Avocados are being referred to/requested.,MED-4620 MED-5010 MED-5009 MED-4619 MED-4618 MED-5011 MED-3203 MED-3942 MED-3132 MED-4869
Does milk have a positive impact on our bone health?,MED-1337 MED-1340 MED-4722 MED-4894 MED-2771 MED-3228 MED-5194 MED-1226 MED-2772 MED-4751
Mevacor is a name of a drug.,MED-3110 MED-2810 MED-4418 MED-2284 MED-5001 MED-2790 MED-2815 MED-3663 MED-1811 MED-3022
Identify the barriers that hinder the prevention of heart disease.,MED-1679 MED-2525 MED-1194 MED-4613 MED-4255 MED-1677 MED-1399 MED-1680 MED-1678 MED-1363
The study known as Harvard Physicians’ Study II.,MED-2760 MED-2758 MED-1795 MED-2761 MED-1377 MED-1227 MED-1543 MED-1399 MED-1549 MED-2587
Should I snack or not?,MED-4287 MED-1533 MED-1534 MED-3896 MED-1538 MED-3143 MED-4250 MED-1535 MED-4284 MED-3351
Industrial toxins refer to harmful substances produced by industries.,MED-4602 MED-2650 MED-3590 MED-1280 MED-1726 MED-4911 MED-1570 MED-4870 MED-2616 MED-4908
Prunes are available.,MED-3904 MED-4250 MED-1950 MED-2280 MED-1795 MED-5073 MED-4716 MED-3738 MED-3945 MED-3743
What is Splenda?,MED-2204 MED-2065 MED-2210 MED-3486 MED-4126 MED-4456 MED-2087 MED-4867 MED-4125 MED-4868
Leucine is a type of amino acid.,MED-5239 MED-4306 MED-2126 MED-1267 MED-4419 MED-1266 MED-4876 MED-3276 MED-3281 MED-5165
Clinical evidence demonstrates the impact of flaxseeds on breast cancer survival.,MED-1825 MED-3836 MED-5116 MED-1826 MED-3840 MED-3877 MED-3832 MED-4440 MED-4233 MED-2437
Pesticides are substances used to control or eliminate pests.,MED-1161 MED-1726 MED-1158 MED-1725 MED-3279 MED-1160 MED-4187 MED-1167 MED-4178 MED-2650
The Dietary Theory of Alzheimers is not significantly altered in its meaning.,MED-2212 MED-4582 MED-2663 MED-1506 MED-4007 MED-1702 MED-4553 MED-1851 MED-2589 MED-1440
Trans fats are a type of fat.,MED-3599 MED-1700 MED-2850 MED-3597 MED-1455 MED-4556 MED-1558 MED-3598 MED-1238 MED-4559
The lawsuit against the meat industry is responsible for exposing the connection between chicken and salmonella.,MED-4429 MED-2745 MED-2741 MED-2743 MED-3880 MED-4426 MED-4354 MED-2736 MED-3882 MED-3892
Any feed is unsafe.,MED-1140 MED-2742 MED-1144 MED-4205 MED-2738 MED-4132 MED-4747 MED-5134 MED-3486 MED-2618
It is unsafe in any way or manner for any type of feed.,MED-1140 MED-2742 MED-1144 MED-2738 MED-5134 MED-4148 MED-4747 MED-4205 MED-4354 MED-4138
There is a link between saturated fat and the progression of cancer.,MED-1781 MED-3862 MED-1455 MED-1718 MED-2434 MED-3878 MED-1506 MED-4450 MED-4823 MED-4233
What is the secret of the Kuna Indians?,MED-5042 MED-2227 MED-5041 MED-2208 MED-5027 MED-2048 MED-3743 MED-1100 MED-2780 MED-2511
A diet can help in preventing strokes.,MED-2698 MED-4831 MED-1677 MED-1394 MED-1408 MED-5039 MED-1691 MED-1329 MED-1399 MED-4298
Seafood is being referred to.,MED-2345 MED-4960 MED-2339 MED-3031 MED-2344 MED-4742 MED-2411 MED-4736 MED-3030 MED-4932
The Atkins diet is a low-carbohydrate weight loss program.,MED-1674 MED-4880 MED-1616 MED-2591 MED-4515 MED-2586 MED-2588 MED-4989 MED-1450 MED-1445
Turmeric Curcumin is used for treating Osteoarthritis.,MED-2819 MED-2800 MED-2788 MED-2817 MED-2831 MED-2813 MED-2815 MED-2810 MED-2814 MED-2783
"Tumors are deprived of their blood supply, causing them to starve.",MED-3280 MED-3548 MED-3282 MED-2513 MED-3551 MED-4690 MED-1712 MED-4464 MED-4536 MED-4116
What are some foods that can help with glaucoma?,MED-4384 MED-2900 MED-2901 MED-3480 MED-2896 MED-3869 MED-1494 MED-2145 MED-4833 MED-2066
The concept of dietary scoring.,MED-5327 MED-4480 MED-1377 MED-2523 MED-2294 MED-1210 MED-4629 MED-1565 MED-4104 MED-2591
Carrageenan is a substance and its meaning should not be altered.,MED-3501 MED-3499 MED-3502 MED-3495 MED-3496 MED-3500 MED-3494 MED-3816 MED-4451 MED-3808
Adenovirus 36 causes illnesses.,MED-1804 MED-1808 MED-1798 MED-1796 MED-1799 MED-1800 MED-2749 MED-4766 MED-1810 MED-4767
What is myelopathy?,MED-1105 MED-3787 MED-3193 MED-1104 MED-1111 MED-1577 MED-1283 MED-3949 MED-1115 MED-1279
The Enzyme Myth is true at times.,MED-4649 MED-2716 MED-3452 MED-4156 MED-2673 MED-2699 MED-2988 MED-4612 MED-4830 MED-1463
A scoring system is used to evaluate diets.,MED-2294 MED-1210 MED-2522 MED-2591 MED-1402 MED-1377 MED-4104 MED-4744 MED-4514 MED-3230
The pumpkin is being referred to.,MED-2438 MED-3945 MED-2202 MED-4705 MED-4419 MED-2206 MED-2204 MED-4295 MED-1880 MED-4543
There is a connection between acne and cancer.,MED-2120 MED-4752 MED-5107 MED-2122 MED-2114 MED-4396 MED-2124 MED-2414 MED-5087 MED-5086
Does the size of stool affect the risk of breast cancer?,MED-4639 MED-4517 MED-1416 MED-2424 MED-4785 MED-3844 MED-3858 MED-3860 MED-2438 MED-4069
Arkansas is the subject of the following query.,MED-1960 MED-1957 MED-3769 MED-2168 MED-1273 MED-4134 MED-1282 MED-4075 MED-3319 MED-1283
Rapamycin is a type of drug.,MED-2134 MED-2521 MED-2127 MED-2137 MED-2517 MED-2132 MED-2128 MED-2139 MED-5237 MED-5239
"Which is superior, fresh fruit or frozen fruit?",MED-917 MED-2285 MED-3738 MED-3714 MED-3946 MED-2280 MED-2922 MED-3203 MED-2453 MED-2074
Bronchiolitis obliterans is a condition involving inflammation and obstruction of the bronchioles.,MED-3386 MED-3387 MED-3385 MED-3704 MED-2982 MED-2472 MED-2797 MED-2799 MED-4564 MED-3313
The impact of eggs on arterial function is being studied.,MED-4324 MED-2371 MED-2372 MED-1890 MED-2697 MED-1889 MED-2591 MED-2939 MED-5124 MED-5330
There were accidents.,MED-2400 MED-3636 MED-1279 MED-3567 MED-5347 MED-3632 MED-2082 MED-1205 MED-1731 MED-4609
Whiting is a type of fish.,MED-1570 MED-4959 MED-3592 MED-4964 MED-2345 MED-4874 MED-2661 MED-4811 MED-4792 MED-4968
Zoloft is a medication.,MED-1352 MED-3110 MED-3540 MED-3670 MED-4987 MED-3204 MED-4671 MED-1348 MED-1354 MED-3919
Hyperactivity refers to excessive levels of activity or restlessness.,MED-3380 MED-1916 MED-1516 MED-4663 MED-3383 MED-2722 MED-1355 MED-3381 MED-2715 MED-2078
Blocking the supply lines of tumors is known as anti-angiogenesis.,MED-2573 MED-3554 MED-3840 MED-3548 MED-2067 MED-2357 MED-3550 MED-3549 MED-1317 MED-3551
Carcinogens are substances that can cause cancer.,MED-4391 MED-1414 MED-4049 MED-3765 MED-2106 MED-2435 MED-4060 MED-4483 MED-4433 MED-4451
Chicken Nuggets contain what substance?,MED-2991 MED-2088 MED-3089 MED-3096 MED-1797 MED-4626 MED-4053 MED-1956 MED-4472 MED-3086
"Bone fractures can be rephrased as ""Fractures occur in bones.""",MED-5145 MED-2987 MED-1341 MED-1337 MED-4722 MED-1340 MED-1338 MED-3216 MED-2797 MED-1339
Polypropylene plastic is a type of plastic.,MED-2644 MED-4186 MED-3173 MED-1794 MED-3719 MED-2445 MED-3279 MED-4935 MED-4938 MED-4973
Cheese mites and maggots both exist as pests in cheese.,MED-4403 MED-5109 MED-335 MED-2775 MED-3279 MED-1161 MED-4957 MED-1218 MED-1977 MED-3175
It is possible to eat healthy while on a budget.,MED-4600 MED-2220 MED-4313 MED-1650 MED-1528 MED-1377 MED-5101 MED-2511 MED-1210 MED-2201
What are the principles and guidelines that govern the conduct of healthcare professionals in relation to moral and ethical considerations?,MED-1878 MED-5346 MED-4673 MED-4598 MED-3755 MED-3757 MED-1351 MED-3718 MED-5123 MED-3759
Unhealthy food is also known as junk food.,MED-3896 MED-2423 MED-2726 MED-1208 MED-4559 MED-2220 MED-2595 MED-1140 MED-3057 MED-3441
The evidence is converging.,MED-1502 MED-1754 MED-3678 MED-5063 MED-5001 MED-1777 MED-3717 MED-1140 MED-5123 MED-1178
What is the definition of eggnog?,MED-2884 MED-1889 MED-2371 MED-2372 MED-2976 MED-2293 MED-2977 MED-2030 MED-2475 MED-2033
Can you provide information about DHA?,MED-5095 MED-5091 MED-4936 MED-5092 MED-4323 MED-5093 MED-1832 MED-3012 MED-4322 MED-4633
Chanterelle mushrooms are referred to as what?,MED-3989 MED-3712 MED-3707 MED-3991 MED-3986 MED-3743 MED-2521 MED-2280 MED-3279 MED-2049
The comparison between aluminum in vaccines and aluminum in food.,MED-1848 MED-4909 MED-1839 MED-1850 MED-1843 MED-3087 MED-1852 MED-1845 MED-3497 MED-1847
Where is pumpkin found?,MED-2438 MED-4716 MED-4295 MED-3945 MED-2009 MED-5019 MED-4705 MED-4419 MED-2206 MED-2202
What about seafood?,MED-4960 MED-3031 MED-2344 MED-2345 MED-2339 MED-4968 MED-5101 MED-2411 MED-4736 MED-4932
The state called Arkansas.,MED-1957 MED-2361 MED-3769 MED-1729 MED-3288 MED-4967 MED-4948 MED-2722 MED-1283 MED-1279
What is the frequency of bowel movements?,MED-5175 MED-4638 MED-2100 MED-4641 MED-4810 MED-4325 MED-2055 MED-3143 MED-1188 MED-4637
"The dietary guidelines cover a range of topics, including the consumption of dairy products and berries.",MED-1363 MED-2924 MED-2076 MED-3480 MED-2966 MED-5192 MED-2290 MED-1795 MED-2765 MED-4903
Grapes are needed.,MED-3204 MED-3207 MED-398 MED-2668 MED-2669 MED-2083 MED-3203 MED-2966 MED-3210 MED-1533
What is a fruit that is better than goji berries?,MED-4712 MED-2886 MED-3738 MED-2079 MED-2076 MED-2922 MED-3203 MED-2924 MED-1182 MED-2665
Pork is the subject of the query.,MED-1610 MED-3307 MED-3288 MED-2671 MED-4134 MED-4593 MED-3319 MED-4129 MED-1977 MED-4139
Drinking coffee has an effect on artery function.,MED-1648 MED-1642 MED-1640 MED-1639 MED-1645 MED-1637 MED-1641 MED-1647 MED-5039 MED-2155
Heart nerve control is being enhanced.,MED-4243 MED-2224 MED-5152 MED-2047 MED-1639 MED-1192 MED-2384 MED-2669 MED-1512 MED-5265
Chronic headaches may be caused by pork parasites.,MED-3175 MED-3288 MED-3177 MED-4818 MED-4814 MED-3319 MED-1218 MED-3171 MED-2339 MED-4134
Common diseases are combated by consuming more than just one apple per day.,MED-1792 MED-5019 MED-3908 MED-1146 MED-4832 MED-3744 MED-1795 MED-4089 MED-2022 MED-3900
Doctors were named a leading killer and their response was observed.,MED-3636 MED-1350 MED-2525 MED-2082 MED-1655 MED-1543 MED-1545 MED-3749 MED-4512 MED-3760
There is hormonal dysfunction.,MED-2330 MED-3919 MED-3590 MED-2122 MED-2650 MED-1763 MED-557 MED-3795 MED-1100 MED-4185
What is a hernia?,MED-3177 MED-4424 MED-3175 MED-3178 MED-2345 MED-666 MED-4652 MED-2330 MED-1578 MED-3732
The new recommendations shed some light on Vitamin D.,MED-714 MED-919 MED-4872 MED-4575 MED-3985 MED-3991 MED-3990 MED-4574 MED-2765 MED-4566
Low-carb diets are often effective for weight loss.,MED-2591 MED-4515 MED-2588 MED-1616 MED-2586 MED-4292 MED-4984 MED-4880 MED-4985 MED-1674
The enlargement of the prostate can be treated with diet.,MED-4236 MED-3243 MED-4234 MED-3874 MED-3878 MED-3877 MED-5337 MED-4233 MED-4890 MED-4888
Pineapples are what the query is referring to.,MED-3744 MED-5160 MED-3945 MED-3745 MED-3207 MED-398 MED-3743 MED-5019 MED-4618 MED-1792
Kiwifruit can be used to treat Irritable Bowel Syndrome.,MED-4325 MED-3539 MED-1686 MED-4832 MED-1695 MED-718 MED-2811 MED-1682 MED-3904 MED-2203
Are worms considered to be a type of insect?,MED-4198 MED-5094 MED-3279 MED-2346 MED-3175 MED-1216 MED-5023 MED-4135 MED-3177 MED-4672
Olive oil has an effect on artery function.,MED-5274 MED-5271 MED-5269 MED-5273 MED-5260 MED-1373 MED-5153 MED-1393 MED-4249 MED-1390
What is peanut butter?,MED-4284 MED-4706 MED-2150 MED-2382 MED-4287 MED-4289 MED-2010 MED-2381 MED-4291 MED-4707
Avocados have health benefits.,MED-4620 MED-5010 MED-4619 MED-2595 MED-1378 MED-3199 MED-3942 MED-1686 MED-1695 MED-2227
How is lard made?,MED-1397 MED-3087 MED-3499 MED-5016 MED-2206 MED-4090 MED-2672 MED-2700 MED-1921 MED-4976
The person is in a coma.,MED-1523 MED-3177 MED-4380 MED-4381 MED-3179 MED-3937 MED-3181 MED-3538 MED-991 MED-2663
There is maple syrup available.,MED-5056 MED-4150 MED-2490 MED-5057 MED-3945 MED-3738 MED-5054 MED-3734 MED-1671 MED-2280
"Pepper and turmeric are added to V8 juice, right?",MED-2783 MED-2809 MED-2816 MED-2825 MED-2810 MED-2794 MED-3945 MED-2780 MED-2817 MED-5000
Diet can be used to counteract the effects of dioxins.,MED-3100 MED-1961 MED-3109 MED-1958 MED-3102 MED-2756 MED-5105 MED-4833 MED-5102 MED-3099
Cumin is a spice.,MED-2780 MED-2830 MED-2810 MED-2783 MED-2809 MED-2819 MED-2815 MED-2818 MED-2785 MED-3807
"Dental X-rays are safe, right?",MED-3621 MED-3619 MED-3618 MED-2093 MED-4019 MED-4034 MED-3639 MED-4036 MED-3606 MED-3627
What is saturated fat?,MED-1506 MED-1781 MED-1556 MED-1455 MED-5014 MED-1238 MED-5267 MED-4033 MED-3862 MED-1557
Artificial colors have negative effects on health.,MED-3381 MED-3382 MED-2618 MED-1625 MED-5062 MED-3359 MED-1624 MED-5054 MED-3351 MED-1630
Can B vitamins prevent brain loss?,MED-994 MED-980 MED-986 MED-5128 MED-5135 MED-982 MED-1505 MED-3452 MED-2762 MED-2758
Can Probiotics prevent the Common Cold?,MED-3683 MED-3680 MED-3695 MED-4762 MED-3693 MED-3692 MED-3690 MED-2482 MED-3688 MED-3691
Is there any update on the scary in vitro avocado data?,MED-5009 MED-4618 MED-3942 MED-4619 MED-5011 MED-4369 MED-5010 MED-4620 MED-4767 MED-3946
The risks of alcohol compared to its benefits should be evaluated.,MED-3768 MED-4994 MED-3767 MED-3762 MED-3696 MED-4377 MED-1627 MED-3766 MED-1646 MED-5098
Turnips are a type of vegetable.,MED-2066 MED-3245 MED-2070 MED-2073 MED-4350 MED-3480 MED-4738 MED-2064 MED-2009 MED-3370
Pork tapeworms can cause chronic headaches.,MED-3175 MED-3288 MED-3319 MED-3169 MED-1218 MED-3515 MED-3177 MED-4874 MED-3307 MED-1977
There is an issue with hormone functioning.,MED-2650 MED-1595 MED-4322 MED-4157 MED-2643 MED-4747 MED-1522 MED-4751 MED-1099 MED-3919
The goal is to stop heart disease in childhood.,MED-3253 MED-1548 MED-3954 MED-1213 MED-4613 MED-4255 MED-1999 MED-4243 MED-2525 MED-1679
Apple cider vinegars health benefits include advantages for ones well-being.,MED-942 MED-5019 MED-2668 MED-3744 MED-1792 MED-3738 MED-2669 MED-4590 MED-4415 MED-3908
What is the recommended way to take probiotics?,MED-3679 MED-3692 MED-3693 MED-3695 MED-4762 MED-3688 MED-3690 MED-3680 MED-3676 MED-2482
beans from the broad bean plant,MED-2010 MED-2147 MED-2570 MED-3138 MED-2144 MED-1880 MED-5080 MED-4991 MED-5078 MED-5079
Cholesterol statin drugs are responsible for causing breast cancer.,MED-14 MED-2429 MED-10 MED-2431 MED-4759 MED-2427 MED-2428 MED-2435 MED-3832 MED-2434
Crohns Disease can be treated through dietary considerations.,MED-1578 MED-3961 MED-3966 MED-1582 MED-1580 MED-1425 MED-1579 MED-1581 MED-3965 MED-1574
The public is being buttered up by the Saturated Fat Studies.,MED-1556 MED-3198 MED-1366 MED-1498 MED-1557 MED-1558 MED-3358 MED-1554 MED-5267 MED-1700
Fenugreek can be used to increase muscle strength.,MED-4747 MED-4405 MED-4145 MED-4829 MED-2271 MED-1520 MED-4150 MED-1491 MED-3220 MED-3235
A diet that is based on plants.,MED-4613 MED-4255 MED-1991 MED-4689 MED-2951 MED-5083 MED-4831 MED-1489 MED-3931 MED-1450
Cadaverine is a chemical compound.,MED-4958 MED-4546 MED-3962 MED-4059 MED-4197 MED-3282 MED-3279 MED-2168 MED-1267 MED-3847
The frequency of bowel movements.,MED-5175 MED-4638 MED-2100 MED-4641 MED-4810 MED-2055 MED-4325 MED-3143 MED-1188 MED-4637
What is meant by antinutrients?,MED-4518 MED-5083 MED-3452 MED-4689 MED-2951 MED-2988 MED-1499 MED-3485 MED-4393 MED-4149
The effects of dioxins are counteracted through diet.,MED-3100 MED-1961 MED-3102 MED-3109 MED-2400 MED-2756 MED-2458 MED-4940 MED-2495 MED-3591
Chicken Nuggets contain what ingredients exactly?,MED-2991 MED-3089 MED-5110 MED-1797 MED-4626 MED-3096 MED-2088 MED-4053 MED-1801 MED-2009
Splenda is a low-calorie sweetener.,MED-5057 MED-5054 MED-4868 MED-4822 MED-1630 MED-2195 MED-1710 MED-4120 MED-3733 MED-5113
Bisphenol A (BPA) in plastic can cause male sexual dysfunction.,MED-4186 MED-4185 MED-3590 MED-4992 MED-2650 MED-2644 MED-2643 MED-3421 MED-2647 MED-4230
Kidney beans are a type of legume.,MED-3136 MED-1880 MED-3132 MED-2147 MED-2010 MED-5112 MED-3138 MED-2140 MED-4510 MED-4991
What is Canker sores.,MED-3177 MED-1570 MED-2345 MED-3966 MED-941 MED-4966 MED-4428 MED-3720 MED-2037 MED-2271
Coconut milks nutritional benefits are good for your health.,MED-5014 MED-5039 MED-2227 MED-4000 MED-1337 MED-4002 MED-5012 MED-4286 MED-4298 MED-2595
What is Endocrine disruptors?,MED-2650 MED-2643 MED-2627 MED-2087 MED-2658 MED-5323 MED-1100 MED-2654 MED-1099 MED-1732
What is leucine?,MED-2126 MED-5239 MED-4419 MED-4526 MED-4281 MED-2271 MED-2888 MED-1126 MED-3849 MED-5165
Is oxen meat available?,MED-5326 MED-4437 MED-4747 MED-2780 MED-3891 MED-4408 MED-5110 MED-2700 MED-1770 MED-1977
African-Americans are being referred to.,MED-1747 MED-4095 MED-1115 MED-1475 MED-2900 MED-1417 MED-5335 MED-1994 MED-2213 MED-1993
CT scan radiation increases the risk of developing cancer.,MED-2940 MED-3627 MED-3624 MED-3623 MED-3619 MED-3621 MED-2947 MED-2157 MED-1611 MED-3625
Do antioxidant-rich spices have the ability to offset the effects of a high-fat meal?,MED-760 MED-5265 MED-1383 MED-2458 MED-2970 MED-2951 MED-4689 MED-5271 MED-3820 MED-4516
There is a fish fog.,MED-4966 MED-3783 MED-1570 MED-4811 MED-1572 MED-4959 MED-1573 MED-4379 MED-5099 MED-4874
Cocaine is a drug.,MED-3044 MED-3046 MED-4439 MED-2315 MED-2284 MED-3056 MED-1624 MED-3052 MED-3055 MED-1570
What happens if we add both pepper and turmeric to V8 juice?,MED-2783 MED-5000 MED-2809 MED-2794 MED-2926 MED-2810 MED-2816 MED-2825 MED-2817 MED-2606
Viral infections are communicable diseases caused by viruses.,MED-4766 MED-4564 MED-3974 MED-4433 MED-3294 MED-4363 MED-5061 MED-4812 MED-2749 MED-3321
Walnut oil is what this query is about.,MED-2152 MED-5153 MED-4303 MED-1386 MED-4705 MED-4249 MED-2378 MED-4708 MED-2379 MED-2381
Plants that are toxic.,MED-2327 MED-2070 MED-1741 MED-1737 MED-5083 MED-3100 MED-4915 MED-3488 MED-1726 MED-4914
What is Dragons Blood?,MED-4525 MED-4526 MED-2523 MED-2888 MED-3876 MED-4501 MED-3465 MED-4527 MED-1192 MED-4456
Junk food is a term used to describe unhealthy or low-nutrient food.,MED-3896 MED-3375 MED-2423 MED-4288 MED-2220 MED-3654 MED-4036 MED-3149 MED-3770 MED-2595
Dragon fruit is good for you.,MED-1695 MED-1686 MED-3942 MED-2924 MED-2922 MED-5022 MED-2079 MED-398 MED-3207 MED-4712
Apple juice could potentially have more negative health effects compared to sugar water.,MED-1792 MED-5019 MED-4590 MED-1627 MED-2969 MED-3908 MED-3206 MED-1108 MED-4901 MED-1707
Meat purge and cola share commonalities.,MED-3891 MED-4040 MED-3052 MED-4485 MED-1601 MED-2584 MED-3499 MED-1220 MED-4408 MED-4474
What is Domoic acid?,MED-4380 MED-4381 MED-5095 MED-1267 MED-3022 MED-4055 MED-5091 MED-1278 MED-4958 MED-1570
The duration needed to detox from fish before pregnancy is how long?,MED-2905 MED-3032 MED-1955 MED-3021 MED-2917 MED-4551 MED-4376 MED-5097 MED-4038 MED-3034
Blood clots are what the query is referring to.,MED-2077 MED-2523 MED-1696 MED-1205 MED-3421 MED-4501 MED-1192 MED-2368 MED-1888 MED-1748
Blood clots can form in the body.,MED-2077 MED-1205 MED-1748 MED-1696 MED-4501 MED-4560 MED-1691 MED-2368 MED-1680 MED-1683
There is a presence of liver disease.,MED-1307 MED-1301 MED-1304 MED-4817 MED-4813 MED-1302 MED-3962 MED-2154 MED-4101 MED-2160
You can get rid of excess estrogen.,MED-1594 MED-1768 MED-1597 MED-3701 MED-4751 MED-4899 MED-2648 MED-1592 MED-1596 MED-4160
"Serotonin is a hormone that affects mood, appetite, and sleep.",MED-4308 MED-3526 MED-3524 MED-1352 MED-3532 MED-3539 MED-1198 MED-4309 MED-1349 MED-3661
What is the function of cortisol?,MED-4323 MED-3919 MED-2324 MED-2240 MED-2132 MED-4630 MED-2327 MED-3112 MED-2080 MED-2603
Different techniques used for preparing food.,MED-3651 MED-2183 MED-1161 MED-2742 MED-5074 MED-2209 MED-2572 MED-2673 MED-5076 MED-1441
"Another study demonstrated that carnitine had positive effects on heart health, right?",MED-5039 MED-3788 MED-5265 MED-1554 MED-2591 MED-1399 MED-1512 MED-2597 MED-2587 MED-2590
Tumor supply lines are cut off through anti-angiogenesis.,MED-2573 MED-3554 MED-3840 MED-3548 MED-3549 MED-3550 MED-3551 MED-3878 MED-2513 MED-2357
Believing in any scientific study is possible.,MED-2716 MED-1777 MED-1754 MED-4629 MED-1751 MED-4602 MED-2441 MED-745 MED-1842 MED-2296
The inability to hear.,MED-4668 MED-3177 MED-5343 MED-3538 MED-301 MED-3358 MED-3288 MED-5135 MED-991 MED-5142
Coconut milk has beneficial effects on health.,MED-5039 MED-4335 MED-4000 MED-2227 MED-4002 MED-5014 MED-2597 MED-1686 MED-5151 MED-2774
Broccoli enhances liver function for an extended period.,MED-4456 MED-4040 MED-2070 MED-2816 MED-5075 MED-2068 MED-2098 MED-2074 MED-3199 MED-3377
Subsidies are financial assistance given by the government or a governing body to support certain industries or individuals.,MED-3001 MED-2488 MED-4602 MED-1230 MED-2726 MED-1351 MED-2725 MED-2221 MED-1123 MED-1194
"Crib death refers to the sudden, unexpected death of an infant during sleep, also commonly known as Sudden Infant Death Syndrome (SIDS).",MED-4402 MED-4891 MED-4617 MED-2944 MED-2109 MED-2110 MED-4315 MED-4668 MED-5030 MED-5173
Folic acid is being referred to.,MED-4771 MED-1203 MED-986 MED-4872 MED-1202 MED-980 MED-5128 MED-1198 MED-1201 MED-4513
Growth promoters are being sought without any modification to their intended effect.,MED-4747 MED-2579 MED-2513 MED-2498 MED-4222 MED-4897 MED-3887 MED-3282 MED-2070 MED-1746
What is the condition of deafness?,MED-4668 MED-4424 MED-991 MED-3439 MED-3288 MED-3179 MED-2037 MED-3935 MED-4356 MED-3170
The mystery of apthous ulcer is solved.,MED-4841 MED-2821 MED-735 MED-1575 MED-3966 MED-2345 MED-3970 MED-1184 MED-721 MED-1205
Using diet as a treatment for an enlarged prostate can be effective.,MED-4234 MED-3243 MED-3271 MED-3874 MED-4890 MED-4888 MED-3878 MED-3877 MED-4236 MED-5337
Inflammatory Bowel Disease is related to Titanium Dioxide.,MED-3964 MED-3963 MED-3970 MED-3960 MED-2811 MED-3969 MED-1576 MED-2831 MED-3501 MED-3496
Diet can help prevent cataracts.,MED-4382 MED-2069 MED-4298 MED-4030 MED-4389 MED-4255 MED-4613 MED-1606 MED-1363 MED-2889
Is eggnog a popular holiday drink?,MED-2884 MED-2155 MED-2371 MED-1889 MED-3810 MED-2975 MED-5046 MED-2372 MED-2976 MED-5022
ECMO is an abbreviation for Extracorporeal Membrane Oxygenation.,MED-2109 MED-2110 MED-1638 MED-3732 MED-1980 MED-2619 MED-3353 MED-1314 MED-4808 MED-1311
Do artificial colors have negative effects on your health?,MED-3381 MED-3382 MED-1625 MED-1624 MED-5062 MED-2618 MED-5054 MED-3359 MED-3351 MED-906
Spearmint is a type of herb.,MED-1525 MED-1522 MED-1444 MED-4544 MED-1520 MED-5084 MED-5121 MED-3918 MED-4535 MED-1523
The neurobiology of artificial sweeteners is being investigated.,MED-1624 MED-1623 MED-1630 MED-5054 MED-4120 MED-1625 MED-5053 MED-4126 MED-1108 MED-1626
It is recommended to have Mercury Testing before pregnancy.,MED-5097 MED-4376 MED-3023 MED-4739 MED-3034 MED-2906 MED-3595 MED-3025 MED-3032 MED-2905
It is possible to have faith in any scientific study.,MED-2716 MED-4087 MED-1777 MED-4602 MED-3555 MED-1754 MED-3980 MED-2441 MED-4851 MED-4847
Hiroshima is referenced in the query.,MED-3620 MED-3448 MED-3632 MED-2168 MED-3621 MED-3444 MED-4075 MED-3630 MED-4040 MED-1318
Diet can be used to prevent Ulcerative Colitis.,MED-3964 MED-1187 MED-1582 MED-1576 MED-4628 MED-2811 MED-2782 MED-3970 MED-2809 MED-1184
Does coffee have an impact on artery function?,MED-1648 MED-1639 MED-1642 MED-1640 MED-1645 MED-1641 MED-5039 MED-1637 MED-2222 MED-1647
The Meat Industry Lawsuit is responsible for the presence of salmonella in chicken.,MED-2745 MED-4429 MED-3880 MED-4354 MED-3882 MED-2743 MED-3892 MED-3888 MED-4426 MED-4136
Do multivitamins have any beneficial effects on your health?,MED-2758 MED-2757 MED-2760 MED-2762 MED-4647 MED-2761 MED-4645 MED-4925 MED-2759 MED-4924
