Query,Doc_ID
Childhood constipation is related to the consumption of cows milk.,MED-2058 MED-1223 MED-2063 MED-5194 MED-2055 MED-1226 MED-2061 MED-2053 MED-4897 MED-2126
The person took an excessive amount of greens and possibly suffered from an overdose.,MED-4439 MED-4365 MED-5048 MED-4468 MED-5023 MED-5173 MED-4663 MED-3371 MED-2529 MED-1838
What is the purpose of folic acid?,MED-4771 MED-1420 MED-1203 MED-2762 MED-1198 MED-994 MED-986 MED-3276 MED-982 MED-4600
What is the duration for which a product can be stored without deteriorating in quality or becoming unsafe for consumption?,MED-2074 MED-4859 MED-3693 MED-4474 MED-3490 MED-3738 MED-4205 MED-1140 MED-3087 MED-3679
You can keep your hands warm with citrus.,MED-3204 MED-2711 MED-2083 MED-3483 MED-2713 MED-2707 MED-3476 MED-4392 MED-4804 MED-3203
Dr. Dean Ornishs name is what I am looking for.,MED-1393 MED-1655 MED-2763 MED-2587 MED-4989 MED-3407 MED-4726 MED-5262 MED-4710 MED-1920
The Global Burden of Disease Study aims to determine the worldwide burden of diseases.,MED-983 MED-2082 MED-5293 MED-5303 MED-1680 MED-2723 MED-4132 MED-2214 MED-2211 MED-1703
Does white meat or dark meat contain a higher amount of antibiotics?,MED-2492 MED-4983 MED-1977 MED-1978 MED-4167 MED-3891 MED-1178 MED-1983 MED-4166 MED-1257
What are industrial toxins?,MED-2650 MED-3590 MED-1958 MED-1570 MED-2327 MED-4870 MED-2654 MED-4060 MED-1280 MED-3636
Can cortisol levels be affected by stress?,MED-3671 MED-2324 MED-3919 MED-2741 MED-1933 MED-988 MED-3676 MED-4981 MED-1200 MED-1918
Conflicts of Interest in the Academy of Nutrition and Dietetics.,MED-2220 MED-2725 MED-1351 MED-2112 MED-3487 MED-1553 MED-4674 MED-4599 MED-3718 MED-1149
Whats Fenugreek?,MED-4150 MED-2009 MED-1825 MED-3836 MED-2010 MED-1444 MED-3811 MED-4416 MED-3549 MED-2075
Dental X-Rays are safe.,MED-3621 MED-3619 MED-3618 MED-2093 MED-3639 MED-4036 MED-4034 MED-4019 MED-3606 MED-3627
Is Hiroshima the name of a city?,MED-3620 MED-3632 MED-4176 MED-2511 MED-2330 MED-4060 MED-3630 MED-2172 MED-982 MED-3033
Fenugreek can be used to boost muscle strength.,MED-4747 MED-2271 MED-4405 MED-4150 MED-1520 MED-4829 MED-3220 MED-4145 MED-3228 MED-1750
It is possible to eat healthy on a budget.,MED-4600 MED-2220 MED-1650 MED-4313 MED-1528 MED-2201 MED-1377 MED-2511 MED-1179 MED-2180
Titanium dioxide is a substance.,MED-3969 MED-3963 MED-3970 MED-3960 MED-5059 MED-1185 MED-1843 MED-4869 MED-1844 MED-4317
How long does it take to detox from fish before pregnancy?,MED-3032 MED-2905 MED-3021 MED-2917 MED-4376 MED-5097 MED-3034 MED-1958 MED-1572 MED-1961
Having excessive iodine can be equally detrimental as having insufficient iodine.,MED-4662 MED-4665 MED-4668 MED-4666 MED-4664 MED-3444 MED-3445 MED-3971 MED-3608 MED-3448
What is BMAA?,MED-1267 MED-1287 MED-1278 MED-1288 MED-1266 MED-1289 MED-4876 MED-1265 MED-1268 MED-1279
What is the comparison between treating asthma with plants and treating asthma with supplements?,MED-2452 MED-5072 MED-2458 MED-2482 MED-2655 MED-5083 MED-2464 MED-2472 MED-2475 MED-2471
The calcium content in plants is being compared to that of cows.,MED-4682 MED-5192 MED-3854 MED-1319 MED-2264 MED-1774 MED-1250 MED-334 MED-3226 MED-5109
It is advisable for diabetics to regularly monitor their pulses.,MED-2148 MED-2145 MED-3583 MED-2005 MED-1992 MED-2008 MED-2001 MED-1999 MED-3423 MED-1619
The aim is to prevent or reduce the consumption of cooked meat carcinogens.,MED-4040 MED-4972 MED-3000 MED-5197 MED-4451 MED-4482 MED-5326 MED-4060 MED-4057 MED-4493
Can you give me a recipe for healthy chocolate milkshakes?,MED-5148 MED-5040 MED-2227 MED-4782 MED-2225 MED-2223 MED-5151 MED-2228 MED-3166 MED-4336
What is the safe amount of alcohol for breast cancer?,MED-3696 MED-3766 MED-3768 MED-3762 MED-3767 MED-3765 MED-3700 MED-1564 MED-1371 MED-3697
Is D3 (cholecalciferol) more preferred than D2 (ergocalciferol)?,MED-4573 MED-961 MED-3991 MED-3987 MED-3988 MED-3989 MED-4566 MED-3990 MED-962 MED-3986
Amnesia is a condition characterized by memory loss.,MED-3179 MED-991 MED-3537 MED-1851 MED-4553 MED-4007 MED-2663 MED-2214 MED-982 MED-1704
Do artificial food colors cause ADHD?,MED-3382 MED-3380 MED-3381 MED-5062 MED-3351 MED-1625 MED-2618 MED-1630 MED-906 MED-2994
Milk and mucus being a myth is being questioned.,MED-4677 MED-2055 MED-4902 MED-1224 MED-4394 MED-2063 MED-5189 MED-4751 MED-1338 MED-2772
Is it necessary to avoid titanium dioxide as a personal choice?,MED-3969 MED-3963 MED-3960 MED-3970 MED-2249 MED-1185 MED-1843 MED-4666 MED-2264 MED-2983
Kuna Indian secret.,MED-5042 MED-4544 MED-2810 MED-4529 MED-2237 MED-4533 MED-4534 MED-3707 MED-2821 MED-2815
It is recommended to undergo mercury testing before pregnancy.,MED-5097 MED-4376 MED-3023 MED-4739 MED-3595 MED-2906 MED-3034 MED-3025 MED-3032 MED-2905
What is the atomic number for sulfur?,MED-1421 MED-1185 MED-1418 MED-3495 MED-4476 MED-3282 MED-723 MED-2065 MED-4320 MED-3630
The person is experiencing breast pain.,MED-666 MED-3800 MED-3795 MED-3797 MED-3792 MED-3801 MED-1825 MED-3793 MED-557 MED-4117
Chernobyl was a disastrous nuclear accident that occurred in Ukraine.,MED-3632 MED-3622 MED-3630 MED-3636 MED-3635 MED-2400 MED-3620 MED-2643 MED-4911 MED-1731
What is kohlrabi?,MED-2065 MED-4325 MED-1444 MED-2070 MED-4712 MED-4526 MED-4455 MED-2071 MED-1578 MED-2068
Ascorbic acid is a type of compound.,MED-1198 MED-3476 MED-1846 MED-4995 MED-5136 MED-4901 MED-1624 MED-1259 MED-4687 MED-4206
Do you have an opinion on Dr. Jenkins perspective on paleolithic diets?,MED-4469 MED-4299 MED-1479 MED-1709 MED-2117 MED-1478 MED-1502 MED-2489 MED-2121 MED-4989
The Academy of Nutrition and Dietetics has conflicts of interest.,MED-2220 MED-2725 MED-1351 MED-2112 MED-3487 MED-1553 MED-3718 MED-1558 MED-4036 MED-1149
There is clinical evidence supporting the relationship between flaxseeds and breast cancer survival.,MED-2437 MED-3836 MED-1826 MED-1825 MED-5116 MED-3123 MED-3840 MED-3832 MED-3238 MED-3127
What is the meaning of DHA?,MED-5095 MED-4323 MED-5091 MED-5092 MED-3012 MED-4936 MED-1832 MED-5093 MED-4322 MED-4321
What is Polypropylene plastic?,MED-4186 MED-3173 MED-2644 MED-1794 MED-2574 MED-4935 MED-3719 MED-2445 MED-4973 MED-4266
A parasite known as the tongue worm.,MED-2345 MED-2346 MED-3175 MED-5094 MED-4742 MED-3177 MED-4963 MED-4957 MED-5024 MED-4956
A hernia is a medical condition characterized by a protrusion of an organ or tissue through a weak spot in the surrounding muscle or connective tissue.,MED-4424 MED-3461 MED-3822 MED-4830 MED-1575 MED-3705 MED-1467 MED-666 MED-2154 MED-2063
The tongue worm is a type of parasite.,MED-2346 MED-2345 MED-3175 MED-3177 MED-4963 MED-4742 MED-3178 MED-4957 MED-5094 MED-4956
The Philippines is a country that is located in Southeast Asia.,MED-3603 MED-5022 MED-4783 MED-1532 MED-3876 MED-2511 MED-4000 MED-1570 MED-4963 MED-4948
Milk is being spoken about.,MED-2055 MED-4751 MED-2123 MED-1229 MED-1337 MED-4394 MED-1768 MED-1338 MED-2653 MED-2774
What is the meaning of ECMO?,MED-2110 MED-2109 MED-1638 MED-3732 MED-1634 MED-3458 MED-1314 MED-3436 MED-762 MED-1313
Heart disease in childhood can be prevented or controlled.,MED-1679 MED-2002 MED-3253 MED-3954 MED-1680 MED-1194 MED-3255 MED-2007 MED-1192 MED-5027
Lard is a type of fat.,MED-2850 MED-1467 MED-1700 MED-5324 MED-1397 MED-1921 MED-4006 MED-4823 MED-1238 MED-4333
What are the risks and benefits of alcohol?,MED-3768 MED-3767 MED-3696 MED-4994 MED-3762 MED-1646 MED-3766 MED-3765 MED-2237 MED-3764
What is Rutin?,MED-4051 MED-3743 MED-2065 MED-4418 MED-4587 MED-2135 MED-2812 MED-3479 MED-2606 MED-4457
How does diet affect cellulite?,MED-3816 MED-3818 MED-3822 MED-2591 MED-5270 MED-5341 MED-4233 MED-3874 MED-1465 MED-2434
Do chronic headaches relate to pork tapeworms?,MED-3175 MED-3288 MED-4818 MED-3169 MED-3319 MED-1977 MED-4672 MED-4814 MED-3515 MED-3307
The bacon is enriched in Vitamin C.,MED-5131 MED-4470 MED-917 MED-4976 MED-3453 MED-3157 MED-1601 MED-2453 MED-3471 MED-5188
Black raspberries are being asked about.,MED-3720 MED-3716 MED-3721 MED-2922 MED-2280 MED-917 MED-1671 MED-5070 MED-2076 MED-2085
Adenovirus 36 is associated with infectobesity in children.,MED-1804 MED-1800 MED-1798 MED-1808 MED-1799 MED-1796 MED-1810 MED-1806 MED-4766 MED-4769
Quinine is a substance.,MED-4075 MED-4051 MED-2093 MED-4607 MED-2793 MED-3279 MED-4418 MED-4774 MED-1570 MED-4870
What is Alli?,MED-5179 MED-3490 MED-4625 MED-3942 MED-2244 MED-3143 MED-3688 MED-2831 MED-1475 MED-1198
Stevia is a plant-based sweetener.,MED-4868 MED-5055 MED-4867 MED-5056 MED-2951 MED-4689 MED-4125 MED-5054 MED-1624 MED-4126
What is lyme disease?,MED-2360 MED-2361 MED-1283 MED-1279 MED-1121 MED-1127 MED-3178 MED-3177 MED-4138 MED-4312
The veggie chicken is a type of food.,MED-2991 MED-1801 MED-2009 MED-1528 MED-5101 MED-1610 MED-4313 MED-4988 MED-1375 MED-4850
To what extent are we chemically contaminated?,MED-2391 MED-4168 MED-1099 MED-4653 MED-4911 MED-2494 MED-4937 MED-2650 MED-5104 MED-4604
Please provide an update on Herbalife®.,MED-5158 MED-5157 MED-4873 MED-4535 MED-3489 MED-4251 MED-4531 MED-4533 MED-4621 MED-2891
Plants contain neurotransmitters found in humans.,MED-3532 MED-4309 MED-3518 MED-1352 MED-1499 MED-3852 MED-1287 MED-5069 MED-2664 MED-3173
Childhood is where heart disease begins.,MED-3253 MED-3954 MED-1366 MED-5344 MED-1949 MED-1680 MED-1932 MED-5014 MED-1409 MED-1994
Mouth cancer is a type of cancer affecting the oral cavity.,MED-3767 MED-3764 MED-4030 MED-3715 MED-3717 MED-2982 MED-4024 MED-4036 MED-3637 MED-4741
What is the healthiest beverage served on airplanes?,MED-1627 MED-2155 MED-5050 MED-1646 MED-1710 MED-4774 MED-3734 MED-4587 MED-3490 MED-1865
The comparison is between caloric restriction and plant-based diets.,MED-3273 MED-4515 MED-5113 MED-3815 MED-2502 MED-4255 MED-4613 MED-1991 MED-3201 MED-1319
What are organotins?,MED-4728 MED-4727 MED-4187 MED-3279 MED-2650 MED-2065 MED-4165 MED-1126 MED-3100 MED-1171
What are the healthiest vegetables?,MED-3744 MED-2201 MED-4350 MED-4583 MED-3245 MED-3474 MED-2066 MED-3480 MED-1693 MED-4861
Fat toxicity contributes to the development of diabetes as a disease.,MED-2154 MED-1460 MED-1996 MED-1238 MED-5239 MED-3869 MED-2396 MED-4101 MED-1236 MED-1463
Halibut is a type of fish.,MED-4966 MED-4959 MED-1570 MED-3592 MED-4874 MED-4964 MED-4811 MED-1572 MED-2411 MED-3028
"""Do poultry workers perform their tasks efficiently?""",MED-3321 MED-4431 MED-3320 MED-4819 MED-3315 MED-4433 MED-2741 MED-4429 MED-2088 MED-4166
Japan is a country in East Asia.,MED-1532 MED-4963 MED-2660 MED-2216 MED-2773 MED-2770 MED-5117 MED-2511 MED-3930 MED-2218
The state of ones muscles in terms of their well-being and functionality.,MED-4640 MED-2300 MED-3460 MED-3462 MED-4829 MED-3461 MED-3235 MED-3220 MED-1458 MED-3459
Arriving at a Vitamin D Recommendation is a challenging task.,MED-919 MED-714 MED-3990 MED-4575 MED-4573 MED-4872 MED-4566 MED-716 MED-4574 MED-3985
The state of ones muscles is important for overall well-being.,MED-4640 MED-2300 MED-3220 MED-3235 MED-1355 MED-3462 MED-3427 MED-1505 MED-4830 MED-3460
Amyloid is related to apple juice.,MED-4590 MED-5019 MED-4587 MED-1792 MED-4267 MED-4585 MED-3945 MED-4591 MED-4089 MED-2491
Broccoli enhances liver function for a long period of time.,MED-4456 MED-4040 MED-2816 MED-2070 MED-2074 MED-5075 MED-2068 MED-2098 MED-4454 MED-5074
What is Phytic acidng?,MED-2988 MED-2578 MED-4319 MED-2544 MED-2979 MED-3237 MED-2986 MED-2705 MED-3091 MED-2574
Walnut oil is what is being referred to.,MED-2152 MED-4303 MED-5153 MED-1386 MED-4249 MED-4705 MED-2378 MED-2379 MED-4708 MED-2381
An aneurysm is what condition?,MED-4555 MED-3180 MED-4423 MED-3177 MED-3438 MED-2345 MED-4564 MED-4424 MED-1283 MED-3428
CT Scan Radiation poses a risk of cancer.,MED-3627 MED-2940 MED-3623 MED-3624 MED-2947 MED-3621 MED-3619 MED-3625 MED-2157 MED-3313
Please provide the information about Panama.,MED-5042 MED-5041 MED-1570 MED-1188 MED-2474 MED-4966 MED-3743 MED-4174 MED-1388 MED-3603
Bronchiolitis obliterans has not been altered in terms of meaning.,MED-3385 MED-3387 MED-3386 MED-2982 MED-3313 MED-3702 MED-2472 MED-2476 MED-3704 MED-2453
Plants contain human neurotransmitters.,MED-3532 MED-4309 MED-3518 MED-5069 MED-1499 MED-1352 MED-4689 MED-2951 MED-2664 MED-2070
Plants that are poisonous.,MED-2070 MED-2327 MED-1741 MED-5083 MED-1737 MED-1731 MED-4914 MED-3100 MED-4915 MED-3488
We are trying to determine the degree of chemical contamination we are experiencing.,MED-4653 MED-2391 MED-2494 MED-4604 MED-4937 MED-4168 MED-2652 MED-4147 MED-4187 MED-1774
Chlorophyll is a green pigment present in plants and algae that helps in photosynthesis.,MED-4197 MED-5023 MED-4385 MED-4203 MED-4309 MED-2816 MED-5024 MED-2899 MED-5069 MED-3522
What is the answer to the Pritikin Puzzle?,MED-4890 MED-1393 MED-1282 MED-2514 MED-1517 MED-4710 MED-2587 MED-4709 MED-2148 MED-1473
The Bush administration was in power.,MED-3603 MED-4732 MED-5343 MED-3630 MED-4949 MED-5303 MED-1133 MED-3635 MED-3381 MED-2382
Goji berries are a type of fruit.,MED-4712 MED-2886 MED-4544 MED-2922 MED-2076 MED-917 MED-3738 MED-3748 MED-1795 MED-3720
Alternative medicine refers to any form of medical treatment that is not widely accepted or practiced by mainstream doctors and healthcare professionals.,MED-4372 MED-3759 MED-1350 MED-3113 MED-2112 MED-4157 MED-4374 MED-3749 MED-3757 MED-1344
Someone is suffering from amnesia.,MED-2663 MED-991 MED-1937 MED-3179 MED-4161 MED-3176 MED-4127 MED-2214 MED-4860 MED-4356
Krill oil supplements and fish oil capsules are being compared to determine which is superior.,MED-928 MED-4936 MED-927 MED-4631 MED-5095 MED-4943 MED-1620 MED-2412 MED-1831 MED-4731
The topic being investigated is the neurobiology of artificial sweeteners.,MED-1624 MED-1630 MED-1623 MED-5054 MED-1625 MED-4120 MED-5053 MED-1108 MED-4126 MED-1626
Mastitis is a condition.,MED-666 MED-3795 MED-3801 MED-3800 MED-4801 MED-4667 MED-4117 MED-731 MED-2055 MED-3792
Wasnt there another study that demonstrated the positive effects of carnitine on the heart?,MED-2590 MED-4405 MED-1554 MED-3788 MED-1512 MED-1399 MED-4243 MED-2587 MED-2591 MED-5265
What is the commonality between Meat Purge and Cola?,MED-1674 MED-1601 MED-4040 MED-2584 MED-4318 MED-4261 MED-3499 MED-5204 MED-2290 MED-3585
Carcinogens found in cooked meat are being avoided.,MED-4972 MED-5197 MED-4040 MED-3000 MED-4060 MED-4068 MED-5326 MED-4057 MED-4451 MED-4482
Which vegetables are the healthiest?,MED-2201 MED-4350 MED-4583 MED-2010 MED-3474 MED-1140 MED-3245 MED-3480 MED-4861 MED-2066
What is norovirus?,MED-2749 MED-2748 MED-4132 MED-4131 MED-4363 MED-4813 MED-4138 MED-1804 MED-4766 MED-4135
Medicine that is grounded in evidence.,MED-2112 MED-1343 MED-3953 MED-2428 MED-5346 MED-1498 MED-745 MED-4840 MED-5123 MED-3678
Endocrine disruptors are substances that affect the normal functioning of the endocrine system.,MED-2650 MED-2643 MED-1099 MED-4728 MED-5323 MED-2087 MED-1100 MED-2627 MED-3955 MED-2658
Okra is a vegetable.,MED-4544 MED-2009 MED-2070 MED-3245 MED-2066 MED-3474 MED-2085 MED-4583 MED-3238 MED-1303
Kohlrabi is a type of vegetable.,MED-2073 MED-2066 MED-2075 MED-1686 MED-2065 MED-2070 MED-2009 MED-4040 MED-3245 MED-2064
Which sweetener is the healthiest?,MED-5054 MED-5057 MED-1627 MED-1625 MED-1630 MED-1108 MED-5056 MED-4868 MED-4120 MED-1707
Workers who work with poultry.,MED-3321 MED-4819 MED-4431 MED-3315 MED-3320 MED-4433 MED-3307 MED-1114 MED-4429 MED-2741
veggie chicken.,MED-2991 MED-1801 MED-4626 MED-2009 MED-4313 MED-1610 MED-4666 MED-1528 MED-5101 MED-4612
One way to prevent abdominal aortic aneurysms is by providing assistance.,MED-4423 MED-4555 MED-3180 MED-4424 MED-1512 MED-3253 MED-4421 MED-3254 MED-1679 MED-1487
Statin drugs that lower cholesterol levels can be attributed to the occurrence of breast cancer.,MED-2429 MED-14 MED-10 MED-2431 MED-3832 MED-2428 MED-3840 MED-2434 MED-1193 MED-1829
Can kiwifruit be used to treat Irritable Bowel Syndrome?,MED-4325 MED-3539 MED-1686 MED-4832 MED-2040 MED-1695 MED-1682 MED-2039 MED-2811 MED-2032
A diet that can help prevent cataracts.,MED-4382 MED-2069 MED-4389 MED-4298 MED-4030 MED-4613 MED-4255 MED-1606 MED-1363 MED-2889
Nuts are included in the following query.,MED-4286 MED-2381 MED-4706 MED-1387 MED-4292 MED-4289 MED-1388 MED-2596 MED-4290 MED-2595
Chocolate milkshakes that are good for your health.,MED-2227 MED-5151 MED-5148 MED-5040 MED-5038 MED-2228 MED-5039 MED-4336 MED-2223 MED-2079
Can eating Fruit & Nut Bars lead to weight gain?,MED-3896 MED-4707 MED-4286 MED-4291 MED-2592 MED-4292 MED-2595 MED-2383 MED-2594 MED-4289
Reducing exposure to alkylphenols through your diet can be achieved by adapting certain strategies.,MED-1961 MED-1164 MED-4978 MED-1169 MED-3348 MED-2644 MED-2494 MED-2070 MED-2658 MED-2661
Mastitis is a query.,MED-666 MED-3795 MED-3800 MED-4667 MED-4801 MED-3801 MED-4117 MED-3792 MED-2056 MED-3797
Fructose is a type of sugar.,MED-1672 MED-5057 MED-1710 MED-1674 MED-1707 MED-3059 MED-1669 MED-2969 MED-717 MED-4822
Distilled fish oil is free of toxins.,MED-1831 MED-4730 MED-928 MED-4961 MED-5100 MED-4943 MED-4631 MED-2756 MED-4731 MED-4959
The importance of cholesterol size: does it matter?,MED-1552 MED-2525 MED-1886 MED-2530 MED-1968 MED-4676 MED-4509 MED-1554 MED-1884 MED-3398
The National Academy of Sciences is being referred to.,MED-4599 MED-4674 MED-2220 MED-4617 MED-2944 MED-714 MED-5345 MED-2257 MED-3718 MED-1283
"Rickets is a medical condition caused by a deficiency in vitamin D, calcium, or phosphate, resulting in weakened or deformed bones.",MED-716 MED-4575 MED-332 MED-3985 MED-4574 MED-4573 MED-3215 MED-5135 MED-3091 MED-3090
Meat is associated with multiple myeloma.,MED-1114 MED-3314 MED-4485 MED-4821 MED-1109 MED-5188 MED-4481 MED-1105 MED-4436 MED-4482
Avocados are beneficial for your health.,MED-4620 MED-5010 MED-3199 MED-1686 MED-1695 MED-5019 MED-2079 MED-2924 MED-2227 MED-2597
Restricting calorie intake.,MED-2138 MED-2509 MED-2506 MED-2513 MED-2502 MED-2325 MED-2519 MED-1715 MED-3201 MED-4996
Organotins are a type of chemical compound containing tin.,MED-4727 MED-4728 MED-4472 MED-2065 MED-2650 MED-2323 MED-3279 MED-4309 MED-1171 MED-3847
The EPIC Study is being referenced.,MED-4278 MED-3699 MED-2696 MED-3123 MED-1529 MED-5145 MED-4483 MED-4628 MED-4261 MED-3435
The city named Peoria.,MED-4543 MED-3288 MED-2361 MED-3379 MED-3945 MED-2281 MED-4179 MED-3302 MED-3085 MED-2574
Beans are being referred to.,MED-4991 MED-2010 MED-1880 MED-2144 MED-2147 MED-3138 MED-3141 MED-3584 MED-2570 MED-2140
It is possible to increase the population of beneficial bacteria in the colon without using probiotics.,MED-3692 MED-3856 MED-3680 MED-3695 MED-4266 MED-3679 MED-4265 MED-3676 MED-3687 MED-3691
Are vegetarians getting sufficient protein intake?,MED-4163 MED-4313 MED-4894 MED-5340 MED-1528 MED-2290 MED-2108 MED-4666 MED-2939 MED-3148
The findings on lymphoma by EPIC were significant.,MED-3314 MED-4436 MED-3699 MED-1817 MED-1114 MED-4483 MED-2696 MED-2693 MED-1156 MED-1103
What is tempeh and how is it made?,MED-4976 MED-5002 MED-2206 MED-4090 MED-4716 MED-2825 MED-3532 MED-2673 MED-5078 MED-4547
Prolactin is a hormone.,MED-3792 MED-3797 MED-2006 MED-1829 MED-1594 MED-4747 MED-1595 MED-3919 MED-2644 MED-4400
How can the presence of good bacteria in the colon be increased without using probiotics?,MED-3679 MED-4266 MED-3692 MED-3695 MED-3680 MED-3691 MED-3687 MED-3690 MED-3677 MED-3693
How does olive oil affect artery function?,MED-5274 MED-5271 MED-5273 MED-5260 MED-5269 MED-1373 MED-5153 MED-1393 MED-1390 MED-5268
Aneurysm is a medical condition.,MED-4555 MED-3180 MED-4423 MED-3177 MED-3178 MED-2345 MED-3438 MED-4424 MED-1283 MED-1279
Viral infections are being searched for.,MED-4766 MED-3974 MED-4564 MED-1796 MED-4768 MED-4363 MED-4118 MED-5061 MED-4815 MED-4358
The NIH-AARP study is a research project conducted by the National Institutes of Health in collaboration with the American Association of Retired Persons.,MED-1230 MED-1504 MED-1565 MED-1498 MED-1559 MED-1377 MED-1501 MED-1560 MED-3953 MED-2257
Fenugreek seeds have advantages or positive effects.,MED-4705 MED-2010 MED-4286 MED-2383 MED-4150 MED-2595 MED-2009 MED-4544 MED-4415 MED-3796
Caramel color does not possess carcinogenic properties.,MED-2994 MED-2618 MED-2785 MED-4197 MED-4418 MED-3502 MED-4470 MED-3359 MED-5019 MED-4049
The condition of the uterus is in good health.,MED-3657 MED-4160 MED-666 MED-3590 MED-3655 MED-1780 MED-557 MED-4751 MED-4764 MED-2122
The BRCA genes refer to the genes known as BRCA1 and BRCA2.,MED-3130 MED-3129 MED-3135 MED-2139 MED-1797 MED-5001 MED-2247 MED-5065 MED-3720 MED-4223
How does diet impact breast cancer?,MED-4450 MED-3862 MED-3791 MED-2439 MED-5341 MED-4642 MED-2437 MED-2424 MED-3551 MED-3799
Should I eat a snack or not?,MED-1533 MED-4287 MED-1534 MED-3896 MED-3351 MED-4250 MED-1538 MED-3143 MED-1535 MED-4284
Is fresh fruit better than frozen fruit?,MED-3738 MED-917 MED-3714 MED-2074 MED-2453 MED-3203 MED-3900 MED-2285 MED-3946 MED-2922
The item is filled completely with lead.,MED-4531 MED-4533 MED-4908 MED-2491 MED-4529 MED-2253 MED-2260 MED-4535 MED-2256 MED-3595
One way to decrease the amount of alkylphenols you consume is by modifying your diet.,MED-1164 MED-2644 MED-4266 MED-2661 MED-1845 MED-2658 MED-2076 MED-1169 MED-2966 MED-1258
What is maple syrup?,MED-4150 MED-5056 MED-5057 MED-2490 MED-4416 MED-3811 MED-4126 MED-3945 MED-1674 MED-1625
Ergothioneine is a compound.,MED-4165 MED-2619 MED-4124 MED-2065 MED-2648 MED-3609 MED-3989 MED-3991 MED-3852 MED-1732
The effects of diet on cellulite.,MED-3818 MED-3816 MED-3822 MED-2586 MED-5341 MED-1419 MED-5270 MED-3878 MED-3836 MED-4347
BPH is a condition related to the prostate gland.,MED-4236 MED-4890 MED-4186 MED-4234 MED-4235 MED-5176 MED-3924 MED-4232 MED-4230 MED-4237
Ways to reduce the risk of Abdominal Aortic Aneurysms.,MED-4555 MED-4423 MED-4424 MED-1679 MED-3253 MED-1512 MED-3254 MED-1691 MED-1680 MED-1554
What are turnips?,MED-2066 MED-2070 MED-2009 MED-2065 MED-4501 MED-2144 MED-4419 MED-3807 MED-4456 MED-2206
There are 300 foods and their antioxidant content.,MED-5056 MED-5083 MED-4149 MED-5084 MED-2951 MED-4689 MED-3744 MED-4413 MED-4523 MED-2223
Milk benefits our bones.,MED-1337 MED-1340 MED-2123 MED-1229 MED-4722 MED-4394 MED-4897 MED-4902 MED-1224 MED-4751
What is the best treatment for constipation?,MED-3904 MED-2203 MED-2062 MED-2059 MED-3933 MED-2054 MED-2057 MED-2055 MED-2060 MED-2061
What is the condition of the soil in terms of its overall level of vitality and productivity?,MED-1161 MED-1147 MED-3890 MED-4640 MED-3657 MED-1182 MED-4951 MED-4489 MED-1181 MED-4442
What are carcinogens?,MED-1414 MED-4391 MED-2106 MED-4049 MED-1605 MED-4483 MED-5197 MED-4451 MED-4197 MED-4060
What is Fosamax?,MED-2135 MED-2992 MED-4771 MED-2244 MED-3276 MED-1112 MED-1791 MED-1203 MED-3232 MED-2831
Turmeric Curcumin is linked to Osteoarthritis.,MED-2800 MED-2819 MED-2788 MED-2825 MED-2809 MED-2831 MED-2803 MED-2817 MED-2810 MED-2605
What is your opinion on Dr. Jenkins perspective regarding paleolithic diets?,MED-4469 MED-4299 MED-1479 MED-1709 MED-2117 MED-1478 MED-2489 MED-1366 MED-1655 MED-2527
Chickpeas are the subject of the following query.,MED-2009 MED-2145 MED-2148 MED-2010 MED-4347 MED-3132 MED-2008 MED-3583 MED-1797 MED-4767
The type of oil mentioned is flax oil.,MED-4443 MED-1493 MED-3868 MED-3864 MED-3867 MED-1825 MED-2378 MED-1494 MED-3836 MED-5179
Citrus can potentially aid in maintaining warmth in your hands.,MED-3204 MED-3483 MED-2707 MED-3476 MED-2713 MED-3744 MED-4392 MED-5019 MED-1686 MED-5039
Ox meat is being discussed.,MED-4408 MED-5326 MED-4437 MED-2671 MED-4747 MED-4261 MED-1256 MED-5110 MED-4626 MED-4472
"Who provides superior advice, pharmacists or health food store employees?",MED-4372 MED-4371 MED-4374 MED-4370 MED-2725 MED-1553 MED-5123 MED-4366 MED-3486 MED-2765
Factory farming practices are being questioned.,MED-4602 MED-1144 MED-1179 MED-4594 MED-4140 MED-4139 MED-4148 MED-730 MED-1979 MED-4802
The National Academy of Sciences is a prestigious institution.,MED-4674 MED-4599 MED-5345 MED-2220 MED-3718 MED-1283 MED-714 MED-1878 MED-4617 MED-2944
Fish can transmit toxins related to sexual activities.,MED-4360 MED-2345 MED-1570 MED-4961 MED-1569 MED-1572 MED-4791 MED-1573 MED-5099 MED-4966
Myelopathy is a condition affecting the spinal cord.,MED-1105 MED-5142 MED-3787 MED-3193 MED-4424 MED-4423 MED-1104 MED-3177 MED-1283 MED-3317
The EPIC findings on Lymphoma have been discovered.,MED-3314 MED-4436 MED-1114 MED-1103 MED-1156 MED-2928 MED-4119 MED-3962 MED-2693 MED-1105
Allergies can be caused by Alkylphenol Endocrine Disruptors.,MED-2658 MED-2643 MED-2650 MED-2087 MED-5323 MED-2627 MED-2652 MED-4728 MED-2644 MED-2654
Coffee is sought after.,MED-2155 MED-1640 MED-1648 MED-5258 MED-1639 MED-2156 MED-3932 MED-1638 MED-1628 MED-1636
Childhood is the starting point for heart disease.,MED-3253 MED-3954 MED-1949 MED-1542 MED-5344 MED-1932 MED-1680 MED-3255 MED-2476 MED-1994
Curcumin should be taken with caution by whom?,MED-2809 MED-2782 MED-1813 MED-2791 MED-1811 MED-2815 MED-2819 MED-1947 MED-2817 MED-2822
Can you provide information on mouth cancer?,MED-4030 MED-3764 MED-3313 MED-3621 MED-3703 MED-3715 MED-4024 MED-5035 MED-3717 MED-4484
Is there a connection between Titanium Dioxide and Inflammatory Bowel Disease?,MED-3964 MED-3963 MED-3970 MED-3960 MED-1576 MED-2811 MED-3501 MED-3969 MED-2809 MED-4342
Arriving at a Vitamin D recommendation is difficult.,MED-714 MED-919 MED-4575 MED-716 MED-4573 MED-3990 MED-3985 MED-4566 MED-2765 MED-4574
Goji berries are not as good as something else.,MED-4712 MED-2886 MED-2076 MED-2924 MED-3748 MED-3465 MED-2922 MED-3738 MED-5070 MED-2925
Airport scanners are devices that are used in airports for security purposes.,MED-3627 MED-3278 MED-2940 MED-4884 MED-1634 MED-4075 MED-3617 MED-3619 MED-4980 MED-1307
A plant-based diet is what?,MED-4613 MED-4255 MED-4831 MED-2951 MED-4689 MED-5083 MED-1991 MED-1489 MED-3931 MED-1723
