Query,Doc_ID
Herbalife® has been updated.,MED-5158 MED-5157 MED-4873 MED-4535 MED-3489 MED-4251 MED-4539 MED-2891 MED-2759 MED-2925
Can eating Fruit & Nut Bars lead to an increase in weight?,MED-3896 MED-4707 MED-4286 MED-2592 MED-4292 MED-2595 MED-4291 MED-2594 MED-2383 MED-3208
What can I do with chickpeas?,MED-2009 MED-2145 MED-2010 MED-2148 MED-2008 MED-3583 MED-3132 MED-4347 MED-2147 MED-4201
Are chronic headaches caused by pork parasites?,MED-3175 MED-3288 MED-3177 MED-3319 MED-3171 MED-4818 MED-4134 MED-3307 MED-1218 MED-1977
is a professor at Harvard University and also serves as the Chair of the Department of Nutrition at the Harvard T.H. Chan School of Public Health and Professor of Medicine at Harvard Medical School.,MED-2112 MED-2489 MED-4599 MED-4674 MED-5123 MED-2220 MED-3718 MED-2765 MED-1479 MED-1230
Combating common diseases goes beyond consuming an apple daily.,MED-1792 MED-3908 MED-5019 MED-3744 MED-1795 MED-4089 MED-1686 MED-2924 MED-2022 MED-4590
What is the healthiest beverage to drink on an airplane?,MED-1627 MED-2155 MED-5050 MED-1646 MED-4774 MED-4587 MED-4331 MED-3490 MED-4050 MED-3588
What is veal?,MED-4801 MED-3499 MED-2264 MED-5061 MED-4363 MED-1770 MED-4313 MED-3778 MED-4747 MED-4437
The mystery of the Apthous Ulcer has been solved.,MED-4841 MED-2821 MED-5023 MED-721 MED-735 MED-1184 MED-1205 MED-3970 MED-1575 MED-3966
The American Dental Association is an organization.,MED-4034 MED-3718 MED-1548 MED-4036 MED-1560 MED-3757 MED-4104 MED-3618 MED-3621 MED-4019
Evidence-based medicine is the practice of using evidence to inform medical decisions.,MED-2112 MED-1343 MED-3953 MED-2428 MED-2716 MED-5346 MED-5123 MED-1350 MED-3626 MED-4602
Are ultra-processed foods inherently unhealthy?,MED-1650 MED-4494 MED-4493 MED-1534 MED-3970 MED-3790 MED-4554 MED-4299 MED-1140 MED-4284
Allergies have a connection to Alkylphenol Endocrine Disruptors.,MED-2658 MED-2643 MED-2650 MED-5323 MED-2087 MED-2627 MED-2644 MED-1100 MED-2654 MED-4728
What are some foods that are beneficial for individuals with glaucoma?,MED-2900 MED-4384 MED-2147 MED-1494 MED-2145 MED-2901 MED-2013 MED-3480 MED-2896 MED-2669
Apnea is a condition where a person temporarily stops breathing while sleeping.,MED-3538 MED-3537 MED-4402 MED-3536 MED-3524 MED-3533 MED-5030 MED-5031 MED-1516 MED-2110
What is Zoloft?,MED-3609 MED-3527 MED-2041 MED-2261 MED-1352 MED-1353 MED-3670 MED-3540 MED-3532 MED-3675
What is the purpose and role of chlorophyll in plants?,MED-4197 MED-2574 MED-4620 MED-5010 MED-4203 MED-2816 MED-5156 MED-5083 MED-3279 MED-2070
The Pritikin Puzzle has been solved.,MED-4890 MED-1393 MED-1282 MED-3945 MED-2116 MED-2514 MED-3288 MED-5093 MED-2587 MED-4710
Dr. Walter Willett is a doctor.,MED-1655 MED-2763 MED-1543 MED-2112 MED-1549 MED-2525 MED-2523 MED-2761 MED-1709 MED-1498
The experiment was successfully taken from the laboratory to the race track.,MED-3457 MED-3454 MED-3274 MED-1810 MED-2648 MED-3458 MED-4506 MED-4243 MED-3894 MED-3895
Saturated fat is a nutrient that should not be consumed in excessive amounts.,MED-4556 MED-1455 MED-5014 MED-1506 MED-1556 MED-1781 MED-1873 MED-3198 MED-1558 MED-1238
The duration for which a product can be stored without any deterioration in quality or safety.,MED-2074 MED-3693 MED-4859 MED-4205 MED-3486 MED-3087 MED-3679 MED-5109 MED-3086 MED-3391
Salmon is a type of fish.,MED-4964 MED-4961 MED-3882 MED-5094 MED-4933 MED-3024 MED-3592 MED-4960 MED-2345 MED-4959
"Who gives better advice, pharmacists or health food store employees?",MED-4372 MED-4371 MED-4374 MED-4370 MED-1553 MED-4366 MED-5123 MED-4774 MED-2750 MED-2765
You can keep your hands warm by using citrus.,MED-2707 MED-3204 MED-2711 MED-3476 MED-3483 MED-2083 MED-2713 MED-4804 MED-3744 MED-3482
The actual benefit of diet versus drugs is the same.,MED-3055 MED-1349 MED-3052 MED-1490 MED-4984 MED-2301 MED-1354 MED-3199 MED-1393 MED-2502
Psoriasis can be treated by adopting plant-based diets.,MED-4255 MED-4613 MED-3931 MED-4831 MED-3243 MED-1489 MED-4030 MED-4389 MED-1874 MED-2432
The norovirus is a type of virus.,MED-2749 MED-2748 MED-4363 MED-3294 MED-4132 MED-4766 MED-1804 MED-4813 MED-4815 MED-4806
Is distilled fish oil free of toxins?,MED-1831 MED-1570 MED-1958 MED-4730 MED-4961 MED-5100 MED-928 MED-4943 MED-2756 MED-4380
Ergothioneine is a compound that is needed in the body.,MED-4165 MED-2619 MED-4124 MED-4197 MED-3991 MED-3989 MED-3852 MED-3609 MED-1594 MED-5003
The process of altering genes through genetic manipulation.,MED-2674 MED-2247 MED-4888 MED-1924 MED-1457 MED-3165 MED-3135 MED-3885 MED-3130 MED-2513
The actual benefit of diet compared to drugs is what?,MED-4984 MED-4985 MED-2301 MED-1490 MED-3199 MED-2522 MED-4389 MED-1488 MED-1192 MED-2524
Are there any subsidies available?,MED-2488 MED-5056 MED-3975 MED-2016 MED-4602 MED-5057 MED-1794 MED-4366 MED-1669 MED-1671
Medical ethics is the ethical principles and moral values that guide healthcare professionals decision-making and conduct.,MED-5346 MED-3755 MED-1878 MED-4673 MED-4598 MED-3757 MED-3604 MED-3759 MED-1344 MED-1351
The Philippines is a country.,MED-3603 MED-4000 MED-4783 MED-3876 MED-1570 MED-3983 MED-4966 MED-3445 MED-1532 MED-3022
"Adenovirus 36 is related to childhood obesity, also known as Infectobesity.",MED-1804 MED-1808 MED-1798 MED-1799 MED-1800 MED-1796 MED-4766 MED-1803 MED-4767 MED-4769
Diet has the potential to prevent strokes.,MED-2698 MED-4831 MED-1677 MED-5039 MED-1408 MED-1329 MED-1691 MED-1394 MED-4603 MED-5301
The study about womens health in Iowa is called Iowa Womens Health Study.,MED-4057 MED-1559 MED-4594 MED-2423 MED-4159 MED-2845 MED-2428 MED-3444 MED-4789 MED-1210
Dragon fruit is beneficial for your health.,MED-1695 MED-1686 MED-2924 MED-2922 MED-2079 MED-3199 MED-3942 MED-3744 MED-3207 MED-398
Which vitamin supplements are worth taking?,MED-4373 MED-2762 MED-4930 MED-3452 MED-4366 MED-5136 MED-4924 MED-4566 MED-4872 MED-2760
Peanut butter is being requested.,MED-4284 MED-4706 MED-2150 MED-4289 MED-4287 MED-2382 MED-3385 MED-3132 MED-2010 MED-4291
What is the state of health in the uterus?,MED-4160 MED-4640 MED-2122 MED-3655 MED-3657 MED-4751 MED-4369 MED-3590 MED-5303 MED-3504
What is benzene?,MED-4857 MED-4973 MED-2793 MED-5065 MED-5197 MED-3670 MED-5122 MED-2169 MED-2619 MED-4975
Taro is being referred to.,MED-3807 MED-3808 MED-3809 MED-3099 MED-4712 MED-2169 MED-4711 MED-2825 MED-3788 MED-4534
"The query seems to be incomplete as it only includes the term ""thiamine."" Please provide more context or rephrase the question for further assistance.",MED-4666 MED-981 MED-4165 MED-4513 MED-5128 MED-3444 MED-1488 MED-2171 MED-4668 MED-988
What is Chanterelle mushrooms.,MED-3989 MED-3712 MED-3707 MED-3991 MED-3986 MED-5121 MED-2048 MED-2049 MED-3279 MED-3535
The query of whether Milk and Mucus is a myth.,MED-4677 MED-1224 MED-2055 MED-1338 MED-4902 MED-4751 MED-1226 MED-2056 MED-4394 MED-1773
What is the healthiest sweetener?,MED-5057 MED-5054 MED-1625 MED-1627 MED-4868 MED-1630 MED-5056 MED-4125 MED-4120 MED-1624
The red tea consists of what?,MED-5156 MED-4777 MED-2094 MED-4332 MED-5050 MED-3203 MED-4050 MED-1645 MED-1844 MED-5052
IGF-1 is an abbreviation referring to a certain query.,MED-1722 MED-4897 MED-4211 MED-4216 MED-4223 MED-4228 MED-1720 MED-1719 MED-1711 MED-4212
Fat toxicity is the underlying cause of diabetes.,MED-1463 MED-2154 MED-1238 MED-1672 MED-1474 MED-1236 MED-2850 MED-1457 MED-1455 MED-3869
Molasses is being referred to.,MED-5056 MED-4869 MED-4782 MED-3581 MED-3945 MED-3811 MED-4416 MED-1671 MED-4867 MED-4125
Mesquite is a type of tree or shrub.,MED-3906 MED-4716 MED-4868 MED-4618 MED-4289 MED-3535 MED-4705 MED-4298 MED-301 MED-5055
Oral intraepithelial neoplasia is a condition that refers to the presence of abnormal cells within the epithelial layer of the oral cavity.,MED-3716 MED-3721 MED-4652 MED-3107 MED-3111 MED-3500 MED-3108 MED-2095 MED-4641 MED-2100
Is pork included in this dish?,MED-1165 MED-4976 MED-1491 MED-1610 MED-4818 MED-1983 MED-4593 MED-4134 MED-4053 MED-2678
Is rapamycin an effective treatment for certain types of cancer?,MED-2134 MED-2137 MED-2507 MED-2139 MED-2127 MED-2128 MED-5237 MED-2521 MED-2517 MED-3271
Restricting caloric intake.,MED-2138 MED-2506 MED-2502 MED-2513 MED-2509 MED-2325 MED-2519 MED-3201 MED-1617 MED-4996
Has there been any new information or progress regarding the frightening avocado data obtained through in vitro testing?,MED-5009 MED-4619 MED-4618 MED-2085 MED-3942 MED-4767 MED-5011 MED-3946 MED-4620 MED-5010
Crib death refers to the phenomenon of a baby unexpectedly dying in their crib.,MED-4402 MED-4891 MED-2109 MED-2110 MED-4617 MED-2944 MED-2082 MED-4315 MED-2598 MED-4668
Cholesterol is related to lower back pain.,MED-4424 MED-2524 MED-4031 MED-2488 MED-3398 MED-5330 MED-2440 MED-1885 MED-4509 MED-1207
Insects exist.,MED-4198 MED-3279 MED-4179 MED-2479 MED-3522 MED-1726 MED-1570 MED-5094 MED-2650 MED-4135
Are vegetarians receiving adequate protein intake?,MED-4163 MED-2108 MED-4894 MED-4313 MED-5340 MED-4666 MED-2290 MED-3148 MED-1528 MED-2939
Japan is a country.,MED-2216 MED-2773 MED-2660 MED-2770 MED-2511 MED-4963 MED-3033 MED-2657 MED-2218 MED-5117
Trans fats are being researched by scientists to determine their impact on human health.,MED-3597 MED-1558 MED-4556 MED-3599 MED-1455 MED-3598 MED-1454 MED-5096 MED-1238 MED-1700
What is liver disease?,MED-1304 MED-1307 MED-2154 MED-1301 MED-4101 MED-1309 MED-1868 MED-1581 MED-1302 MED-1675
"""The Atkins diet is a low-carbohydrate eating plan that helps individuals lose weight.""",MED-1674 MED-4880 MED-2591 MED-1616 MED-4515 MED-2588 MED-2586 MED-4989 MED-4984 MED-1323
BPA plastic is linked to male sexual dysfunction.,MED-4186 MED-4185 MED-3590 MED-4022 MED-4230 MED-4232 MED-4951 MED-4656 MED-4236 MED-1100
"Magnesium is a chemical element with the symbol ""Mg"" on the periodic table.",MED-1838 MED-3918 MED-1111 MED-2261 MED-2248 MED-1406 MED-1107 MED-3960 MED-1110 MED-2992
Comparing caloric restriction with plant-based diets.,MED-5113 MED-4515 MED-3273 MED-3815 MED-3201 MED-4347 MED-1450 MED-1445 MED-1991 MED-1319
What is serotonin?,MED-3532 MED-1352 MED-4309 MED-1349 MED-3530 MED-4306 MED-3661 MED-3540 MED-3526 MED-3546
How much alcohol is safe for breast cancer?,MED-3696 MED-3766 MED-3768 MED-3767 MED-3762 MED-3765 MED-3700 MED-1564 MED-1371 MED-4069
Alternative medicine is another term for non-conventional or holistic forms of treatment.,MED-4157 MED-3113 MED-2786 MED-2824 MED-2330 MED-557 MED-3607 MED-3661 MED-4544 MED-3761
Bacon that has been enriched with Vitamin C.,MED-917 MED-4470 MED-4976 MED-5131 MED-4053 MED-4472 MED-1601 MED-5188 MED-3452 MED-1693
Lyme disease is a medical condition caused by a bacteria transmitted through tick bites.,MED-2360 MED-2361 MED-2355 MED-731 MED-2356 MED-2348 MED-3966 MED-2365 MED-1125 MED-4796
Dr. Dean Ornish is a renowned individual in his field.,MED-1655 MED-3407 MED-2506 MED-4298 MED-1489 MED-1543 MED-2587 MED-2525 MED-4245 MED-5329
Tufts University is a prestigious academic institution.,MED-762 MED-5343 MED-3749 MED-3407 MED-5120 MED-1918 MED-1351 MED-1497 MED-1097 MED-2484
Diet can be utilized to prevent Ulcerative Colitis.,MED-3964 MED-1187 MED-1582 MED-1576 MED-2811 MED-4628 MED-3970 MED-2782 MED-2809 MED-4030
Does Caffeinated Tea Cause Dehydration?,MED-4331 MED-1645 MED-1621 MED-1637 MED-5258 MED-1642 MED-1647 MED-5156 MED-1648 MED-2155
Sulfur is being inquired about.,MED-1185 MED-1418 MED-1421 MED-3282 MED-4320 MED-723 MED-4455 MED-2065 MED-1184 MED-4456
Is D2 (ergocalciferol) inferior to D3 (cholecalciferol) as a preferable form of vitamin D?,MED-4573 MED-961 MED-3991 MED-3987 MED-3988 MED-3989 MED-4566 MED-3990 MED-962 MED-3986
Can plants and supplements be used to treat asthma?,MED-5072 MED-2482 MED-2452 MED-5083 MED-2458 MED-2816 MED-2655 MED-2475 MED-2951 MED-4689
There are bagels.,MED-4716 MED-2169 MED-4287 MED-2041 MED-5110 MED-3896 MED-3442 MED-2144 MED-4746 MED-3895
Parkinsons disease is a neurodegenerative disorder affecting movement and causing symptoms such as tremors and rigidity.,MED-4939 MED-3935 MED-2164 MED-3925 MED-2165 MED-1278 MED-3940 MED-2979 MED-1266 MED-1499
What is the bioavailability?,MED-4320 MED-4909 MED-5095 MED-928 MED-2791 MED-5131 MED-2263 MED-4318 MED-3986 MED-2068
Cauliflower is being referred to.,MED-2064 MED-2070 MED-2066 MED-2075 MED-4544 MED-4455 MED-2009 MED-4794 MED-4456 MED-3836
Psoriasis can be effectively managed by adopting plant-based diets.,MED-3931 MED-4255 MED-4613 MED-4831 MED-1489 MED-3243 MED-4389 MED-4030 MED-1450 MED-2432
Bone fractures occur when there is a break in the bone.,MED-5145 MED-1341 MED-2987 MED-1340 MED-4722 MED-1337 MED-2803 MED-3216 MED-1338 MED-4427
Can probiotics be used to prevent the common cold?,MED-3683 MED-3680 MED-3693 MED-3695 MED-3692 MED-3690 MED-4762 MED-2482 MED-3679 MED-3688
What is titanium dioxide?,MED-3969 MED-3963 MED-3970 MED-3960 MED-5059 MED-2814 MED-1843 MED-2817 MED-2135 MED-2823
The Dietary Theory of Alzheimers suggests a relationship between diet and Alzheimers.,MED-2212 MED-4582 MED-1506 MED-1702 MED-2663 MED-1699 MED-726 MED-1408 MED-1881 MED-2215
Suppositories are medicinal substances that are to be inserted into the rectum or vagina.,MED-1248 MED-1244 MED-557 MED-2818 MED-2788 MED-2782 MED-2244 MED-1184 MED-1794 MED-3503
What are grapes?,MED-3207 MED-398 MED-3204 MED-2083 MED-2668 MED-2669 MED-3203 MED-5065 MED-3205 MED-3200
Antinutrients refer to substances that hinder the absorption or utilization of nutrients in the body.,MED-2984 MED-1499 MED-3199 MED-3452 MED-3485 MED-4393 MED-4317 MED-4286 MED-2988 MED-1791
The bioavailability is the amount of a substance that is able to enter the bloodstream and have an active effect on the body.,MED-4317 MED-2830 MED-2791 MED-1851 MED-4390 MED-4909 MED-3479 MED-3922 MED-3199 MED-4318
Organic foods possess a higher level of safety compared to non-organic foods.,MED-1181 MED-1140 MED-1178 MED-1144 MED-1151 MED-1162 MED-1179 MED-1169 MED-1182 MED-1150
Insects are being referred to.,MED-3279 MED-4198 MED-2345 MED-2650 MED-1570 MED-4179 MED-3522 MED-1726 MED-1216 MED-2330
Red tea is being referred to.,MED-4050 MED-4777 MED-1645 MED-5052 MED-2094 MED-4332 MED-3920 MED-4365 MED-1844 MED-5156
Coffee is a beverage made from brewing ground coffee beans.,MED-4974 MED-2155 MED-1640 MED-5258 MED-1627 MED-1639 MED-5123 MED-1621 MED-4774 MED-1642
Phytates are used for the treatment of cancer.,MED-2435 MED-3832 MED-2814 MED-3555 MED-3854 MED-4543 MED-3548 MED-3551 MED-2579 MED-4777
The object is packed with lead.,MED-2178 MED-4908 MED-4533 MED-4531 MED-2491 MED-4529 MED-3087 MED-2256 MED-3595 MED-2260
Do krill oil supplements outperform fish oil capsules?,MED-928 MED-927 MED-4936 MED-4631 MED-5095 MED-1620 MED-2412 MED-4943 MED-4731 MED-2750
The role of diet in breast cancer.,MED-4642 MED-2434 MED-2423 MED-4452 MED-3551 MED-3791 MED-2437 MED-2439 MED-3142 MED-3701
Multivitamins have positive effects on your health.,MED-2760 MED-2757 MED-2758 MED-4645 MED-2759 MED-2761 MED-4647 MED-4925 MED-2762 MED-4924
The condition of the soil is important for its overall health.,MED-716 MED-4640 MED-2010 MED-1794 MED-1182 MED-4442 MED-4036 MED-4686 MED-1413 MED-3105
The practices used in factory farming.,MED-4602 MED-1179 MED-1161 MED-1978 MED-4747 MED-4932 MED-4148 MED-4139 MED-730 MED-2088
Native Americans are a group of people without altering their meaning.,MED-1100 MED-1417 MED-2572 MED-2213 MED-1747 MED-991 MED-1475 MED-4494 MED-5042 MED-4104
The concept being referred to is memory.,MED-3537 MED-1506 MED-991 MED-5002 MED-1700 MED-2518 MED-3674 MED-4640 MED-5343 MED-2257
Pineapples are being referred to.,MED-3744 MED-5160 MED-1795 MED-3945 MED-398 MED-3207 MED-3743 MED-5019 MED-3738 MED-3906
Does Caramel Color have carcinogenic properties?,MED-2994 MED-2618 MED-2785 MED-4197 MED-4418 MED-3502 MED-4470 MED-4451 MED-4049 MED-4493
Betel nuts are a type of seed used for chewing.,MED-5017 MED-4705 MED-4716 MED-4295 MED-2010 MED-4030 MED-1444 MED-4289 MED-4443 MED-4298
Where to find kidney beans?,MED-2147 MED-3136 MED-2140 MED-3132 MED-1880 MED-2010 MED-2570 MED-5080 MED-4991 MED-1133
The individuals who should exercise caution with curcumin are?,MED-1512 MED-1507 MED-2809 MED-2782 MED-2791 MED-2822 MED-2815 MED-2800 MED-1813 MED-2811
The storage of dioxins in our own fat may result in an increased risk of diabetes.,MED-2405 MED-2850 MED-2845 MED-1461 MED-2388 MED-2400 MED-2394 MED-5270 MED-2395 MED-2495
Where is Panama?,MED-5042 MED-5041 MED-1570 MED-4966 MED-3743 MED-4379 MED-3022 MED-4948 MED-5094 MED-1100
Green Overdose is happening.,MED-5048 MED-4365 MED-4468 MED-5023 MED-4439 MED-3920 MED-4780 MED-1570 MED-1739 MED-4501
Galactosemia is a condition related to the bodys inability to process galactose.,MED-1341 MED-2352 MED-2369 MED-3495 MED-2355 MED-720 MED-2356 MED-2348 MED-724 MED-719
Cows milk and childhood constipation are related.,MED-2063 MED-2055 MED-2059 MED-2061 MED-2126 MED-2058 MED-1223 MED-2060 MED-2057 MED-2053
"The Dietary Guidelines cover a range of foods, including dairies and berries.",MED-2924 MED-2076 MED-5083 MED-1363 MED-3480 MED-4689 MED-2951 MED-4833 MED-2966 MED-1234
What is mesquite?,MED-2087 MED-3022 MED-4716 MED-4126 MED-4075 MED-1111 MED-3670 MED-3305 MED-1624 MED-4705
The size of ones stool has a correlation with the risk of developing breast cancer.,MED-4639 MED-4517 MED-1416 MED-3844 MED-1717 MED-3858 MED-3862 MED-3762 MED-3860 MED-2258
Diets that are low in carbohydrates.,MED-2591 MED-4515 MED-4880 MED-4514 MED-1323 MED-1616 MED-2588 MED-2586 MED-1674 MED-1619
Parkinsons disease is a neurological disorder.,MED-4939 MED-3935 MED-3940 MED-2165 MED-2164 MED-2979 MED-3925 MED-1278 MED-1499 MED-1282
What is Flax oil.,MED-4443 MED-1825 MED-1493 MED-3867 MED-3864 MED-3836 MED-1494 MED-3868 MED-3869 MED-4233
Rhabdomyolysis is a medical condition involving the breakdown of muscle tissue.,MED-5173 MED-4961 MED-3951 MED-4830 MED-1121 MED-3462 MED-1128 MED-3461 MED-1127 MED-1733
Smoking is being referred to.,MED-952 MED-3046 MED-1598 MED-3099 MED-3318 MED-759 MED-2676 MED-2237 MED-1605 MED-1599
Storing dioxins in our own fat could potentially raise the risk of developing diabetes.,MED-2405 MED-1461 MED-2395 MED-2388 MED-2845 MED-2850 MED-2396 MED-1961 MED-2394 MED-2400
Anisakis is a parasitic worm that can be found in certain fish species.,MED-2345 MED-2346 MED-2339 MED-4963 MED-4742 MED-2338 MED-5094 MED-4968 MED-1570 MED-4792
Thiamine is the subject of the following query.,MED-4666 MED-4165 MED-4546 MED-4513 MED-5128 MED-981 MED-4309 MED-4872 MED-4075 MED-4501
Goji berries are being sought after.,MED-4712 MED-2886 MED-4544 MED-2924 MED-2076 MED-1259 MED-2888 MED-3748 MED-3720 MED-2665
Fenugreek Seeds offer numerous benefits.,MED-2010 MED-2595 MED-4286 MED-4150 MED-2009 MED-4443 MED-4705 MED-2383 MED-1493 MED-4544
Leeks are a type of vegetable.,MED-2066 MED-2073 MED-2070 MED-2010 MED-3245 MED-2064 MED-2009 MED-2098 MED-3377 MED-4443
The comparison is between calcium derived from plants and calcium derived from cows.,MED-4682 MED-5192 MED-1319 MED-4751 MED-3232 MED-1768 MED-3918 MED-3227 MED-1138 MED-4898
St. Johns wort is being referred to.,MED-743 MED-3918 MED-2891 MED-2809 MED-1860 MED-3947 MED-1522 MED-3919 MED-1864 MED-3800
"Vaccines and food contain aluminum, but in different amounts.",MED-1839 MED-4909 MED-1843 MED-1845 MED-1850 MED-1852 MED-3087 MED-1851 MED-1847 MED-1848
Finland is a country in northern Europe.,MED-5331 MED-4727 MED-2479 MED-3981 MED-1276 MED-2582 MED-3980 MED-1201 MED-4070 MED-1366
Excess estrogen can be relieved.,MED-1594 MED-1768 MED-4160 MED-557 MED-3701 MED-4751 MED-4162 MED-1597 MED-4785 MED-4899
Can the use of cholesterol statin drugs lead to breast cancer?,MED-2429 MED-10 MED-14 MED-2431 MED-2428 MED-3856 MED-4785 MED-3832 MED-2435 MED-3844
The cause behind Americas obesity problem is what?,MED-1994 MED-2717 MED-1468 MED-2723 MED-1798 MED-4202 MED-4100 MED-2715 MED-1328 MED-1803
The best treatment for constipation is...,MED-2203 MED-3904 MED-2059 MED-2062 MED-3933 MED-2057 MED-2054 MED-2055 MED-2063 MED-2061
Benzene is a chemical compound with a cyclic structure consisting of six carbon atoms.,MED-4857 MED-4973 MED-3847 MED-5080 MED-1126 MED-3785 MED-4059 MED-4037 MED-5065 MED-4049
The Enzyme Myth is true on certain occasions.,MED-2716 MED-3452 MED-4612 MED-4830 MED-2699 MED-2673 MED-2988 MED-4156 MED-3450 MED-1349
What is the best dosage and source of phytosterols for optimal results?,MED-4296 MED-4295 MED-1405 MED-3876 MED-3854 MED-2438 MED-3852 MED-5176 MED-5115 MED-1825
What do leeks refer to?,MED-1580 MED-2070 MED-4363 MED-3499 MED-4428 MED-2009 MED-2010 MED-3876 MED-1126 MED-3849
Does drinking caffeinated tea cause dehydration?,MED-4331 MED-1645 MED-5258 MED-1637 MED-1621 MED-2155 MED-1647 MED-1642 MED-1648 MED-1627
Gaining weight.,MED-4261 MED-2723 MED-5004 MED-2721 MED-1807 MED-1257 MED-3751 MED-4764 MED-4291 MED-1518
Neurocysticercosis is a medical condition involving cysts in the brain.,MED-3178 MED-3177 MED-3169 MED-3180 MED-3170 MED-3172 MED-4672 MED-3179 MED-3181 MED-4356
Is the safety of annatto food coloring being questioned?,MED-906 MED-2618 MED-3381 MED-2994 MED-3382 MED-3497 MED-5062 MED-4869 MED-1140 MED-2725
300 foods have been assessed for their antioxidant content.,MED-5084 MED-5083 MED-4413 MED-3744 MED-2693 MED-2223 MED-4523 MED-5360 MED-4689 MED-2951
Processed foods that are extremely processed.,MED-4493 MED-4494 MED-3790 MED-2285 MED-1600 MED-3738 MED-1689 MED-1534 MED-1650 MED-1601
What is magnesium?,MED-1406 MED-3918 MED-4315 MED-2248 MED-4317 MED-2249 MED-3960 MED-4405 MED-2264 MED-2261
What is tempeh?,MED-4976 MED-5002 MED-2009 MED-2330 MED-2673 MED-4543 MED-2825 MED-3854 MED-4977 MED-4491
Dragons Blood is being sought after.,MED-4525 MED-4526 MED-2523 MED-2888 MED-4501 MED-1838 MED-1192 MED-2700 MED-5071 MED-2492
What is Lindane?,MED-930 MED-4181 MED-2093 MED-2087 MED-4055 MED-1736 MED-3527 MED-3279 MED-1738 MED-2650
The transition from the lab to the track.,MED-4243 MED-3458 MED-3949 MED-306 MED-2910 MED-5331 MED-1936 MED-4148 MED-3895 MED-762
Phytates are used to treat cancer.,MED-2435 MED-5010 MED-4620 MED-3832 MED-3555 MED-3854 MED-2814 MED-2988 MED-2579 MED-3548
The Bush administration was in power for eight years.,MED-4243 MED-4177 MED-5303 MED-3603 MED-4160 MED-4732 MED-3630 MED-3538 MED-5343 MED-3381
"""What is milk?""",MED-2123 MED-1229 MED-1337 MED-2653 MED-4751 MED-2055 MED-4394 MED-4899 MED-4752 MED-2774
Is it true that organic foods are safer?,MED-1140 MED-1144 MED-1179 MED-1169 MED-1151 MED-1150 MED-1173 MED-1162 MED-1182 MED-1178
Tumors can be deprived of their blood supply.,MED-3280 MED-4423 MED-3554 MED-1813 MED-2513 MED-4690 MED-4116 MED-2357 MED-2604 MED-4536
Do eggs affect arterial function?,MED-2372 MED-4324 MED-2371 MED-1890 MED-1889 MED-5124 MED-2697 MED-2939 MED-1885 MED-4741
The impact of vegetables on cancer.,MED-3620 MED-3238 MED-4861 MED-3245 MED-4024 MED-5064 MED-2064 MED-759 MED-1146 MED-3726
The dietary treatment for Crohns Disease involves making specific changes to ones diet.,MED-1578 MED-3961 MED-1425 MED-3966 MED-3252 MED-1580 MED-1582 MED-3965 MED-1574 MED-3970
Antioxidant-rich spices can neutralize the consequences of consuming a high-fat meal.,MED-760 MED-5265 MED-2458 MED-1383 MED-2970 MED-4149 MED-5263 MED-2966 MED-3820 MED-5271
The act of altering genetic material.,MED-2247 MED-2090 MED-2129 MED-2674 MED-1924 MED-2643 MED-3165 MED-3884 MED-3885 MED-1914
Yale: please rephrase the query mentioned in your task requirements.,MED-919 MED-1488 MED-5343 MED-1487 MED-1348 MED-4133 MED-3221 MED-2648 MED-2315 MED-3407
The heart nerve control is being boosted.,MED-4243 MED-2224 MED-1192 MED-2047 MED-2384 MED-5265 MED-1639 MED-4148 MED-1512 MED-2380
Multiple Myeloma is related to meat intake.,MED-4821 MED-4485 MED-5188 MED-1109 MED-4436 MED-5035 MED-4261 MED-4758 MED-1105 MED-1114
Cinnamon is a spice widely used for its distinctive flavor in various dishes and beverages.,MED-2780 MED-4415 MED-3810 MED-3812 MED-3811 MED-4416 MED-2783 MED-1441 MED-2794 MED-1442
Galactosemia is a condition involving the inability to process galactose.,MED-1341 MED-2355 MED-3495 MED-2369 MED-2352 MED-2348 MED-720 MED-3581 MED-719 MED-724
What is the optimal dose of phytosterols?,MED-4295 MED-4296 MED-1405 MED-3854 MED-5115 MED-5178 MED-3876 MED-5176 MED-3852 MED-4566
Worms are what the query pertains to.,MED-3177 MED-2346 MED-5094 MED-3175 MED-4198 MED-4672 MED-4956 MED-3279 MED-3178 MED-4134
Breast cancer is caused by cholesterol statin drugs.,MED-14 MED-10 MED-2429 MED-2431 MED-2427 MED-2434 MED-2428 MED-1193 MED-3840 MED-4830
What is the appropriate way to consume probiotics?,MED-3692 MED-3679 MED-4762 MED-3693 MED-4266 MED-3695 MED-3677 MED-3686 MED-3683 MED-3688
What is Heme iron,MED-4317 MED-2851 MED-1403 MED-2845 MED-2844 MED-1401 MED-4316 MED-2979 MED-4318 MED-2168
Taking vitamin supplements is worth it.,MED-2762 MED-3452 MED-4373 MED-4930 MED-4366 MED-4566 MED-5136 MED-4873 MED-4872 MED-4645
ADHD is related to artificial food colors.,MED-3382 MED-3380 MED-3381 MED-5062 MED-3351 MED-906 MED-2616 MED-4655 MED-4604 MED-1630
The progression of cancer is not affected by saturated fat.,MED-4233 MED-3862 MED-3874 MED-3878 MED-2434 MED-4450 MED-4823 MED-1556 MED-1712 MED-4709
Annatto food colorings safety is assured.,MED-906 MED-2618 MED-2994 MED-3497 MED-3381 MED-4869 MED-2725 MED-5059 MED-3382 MED-1140
What are rickets?,MED-4573 MED-4844 MED-5173 MED-3092 MED-4668 MED-1843 MED-1341 MED-3090 MED-4502 MED-2985
Does white meat or dark meat have more antibiotics?,MED-2492 MED-4983 MED-3891 MED-1977 MED-1983 MED-1978 MED-1178 MED-4167 MED-4166 MED-2671
What is the definition of cadaverine?,MED-4958 MED-4546 MED-2264 MED-2251 MED-2249 MED-1641 MED-2259 MED-2293 MED-1267 MED-1639
What is vitamin K?,MED-3157 MED-2762 MED-716 MED-4575 MED-3452 MED-4470 MED-5131 MED-4573 MED-4872 MED-3990
